full_text,final_cleaned_text
Sudahi semua jangan bikin gaduh terus 20 Oktober 2024 Prabowo Gibran dilantik menjadi presiden kita presiden seluruh rakyat Indonesia Milik kita semua bukan milik yg milih saja kok Mengakui atau tidak akui mereka berdua adalah presiden yang sah dan dipilih secara demokratis https://t.co/J2ifWGv5KV,sudah bikin gaduh 20 oktober 2024 prabowo gibran lantik presiden presiden rakyat indonesia milik milik yg milih aku aku dua presiden sah pilih demokratis
Prabowo Menyambangi Rumah Megawati. Ya sudah ...Gua Ikhlas Prabowo Jadi Presiden Asal Gibran di Diskualifikasi untuk Meredam Konflik Gugatan Pilpres Agar Kostitusi Tetap Terjaga. Apakah Kalian Setuju Tinggalkan Jejak Kalian . . https://t.co/gjZTBskK5v,prabowo sambang rumah megawati ya gua ikhlas prabowo presiden gibran diskualifikasi redam konflik gugat pilpres kostitusi jaga tuju tinggal jejak
RG: Pengumuman Pilpres hari ini: Prabowo Presiden. Jokowi tersangka!️ https://t.co/zEqiDPl6c7,rg umum pilpres prabowo presiden jokowi sangka
Wakil Presiden Republik Indonesia Terpilih. Fufufafa wir iwir iwir iwir. Aku heran utk apa sekolah gelar berderet pangkat seabrek. Tapi yg dipilih....ah sudahlah. Dimana kewibawaan bangsa? https://t.co/LLtPI91YbQ,wakil presiden republik indonesia pilih fufufafa wir iwir iwir iwir heran utk sekolah gelar deret pangkat abrek yg pilih ah mana wibawa bangsa
Bendera merah putih berkibar di Istana Negara Ibukota Nusantara. IKN: Presiden Joko Widodo &amp; Presiden terpilih Prabowo Subianto. Jakarta: Wakil Presiden KH. Ma'Ruf Amin &amp; Wakil Presiden terpilih Gibran Rakabuming Raka. Dirgahayu Republik Indonesia 🇮🇩Ke-79. #HUT_RI_79 https://t.co/E47I4NW9va,bendera merah putih kibar istana negara ibukota nusantara ikn presiden joko widodo amp presiden pilih prabowo subianto jakarta wakil presiden kh ma ruf amin amp wakil presiden pilih gibran rakabuming raka dirgahayu republik indonesia 79 hut ri 79
Saifullah Yusuf alias Gus Ipul diangkat Presiden Jokowi sebagai Menteri Sosial (Mensos) menggantikan Tri Rismaharini. Pelantikan itu tertera dalam Surat Keputusan Presiden Nomor 102B 2024 tentang Pengangkatan Menteri Sosial Kabinet Indonesia Maju 2019-2024. . Menjabat sebagai https://t.co/GbLYuRuf9J,saifullah yusuf alias gus ipul angkat presiden jokowi menteri sosial mensos ganti tri rismaharini lantik tera surat putus presiden nomor 102b 2024 angkat menteri sosial kabinet indonesia maju 2019 2024 jabat
MEREKA HANYA GEROMBOLAN YANG MUDAH DIMANFAATKAN |kurang lebih mereka terdiri atas tiga kelompok. Yang sangat tidak paham yang cuma setengah paham tapi gampang ngamuk dan yang sangat paham tapi juga pintar memanfaatkan. Yang sangat tidak paham dikasih umpan hal remeh. Dikasih https://t.co/DV48yvCTz2,gerombol mudah manfaat kelompok paham paham gampang ngamuk paham pintar manfaat paham kasih umpan remeh kasih
 Saya akan menjadi presiden bagi seluruh rakyat Indonesia. (Prabowo 26 Mei 2024) Jokowi dulu juga gitu waktu pidato pelantikan: Saya akan menjadi presiden bagi seluruh rakyat Indonesia. Saya akan pastikan bahwa seluruh rakyat Indonesia sejahtera. #GantungMatiKoruptor https://t.co/iiEkgQBv5X,presiden rakyat indonesia prabowo 26 mei 2024 jokowi gitu pidato lantik presiden rakyat indonesia pasti rakyat indonesia sejahtera gantungmatikoruptor
Hasil Pilpres dinyatakan final. Bangsa Indonesia mementingkan pelantikan presiden dan wakil presiden tanggal 20 Oktober 2024 https://t.co/ZxVPcQaCxh,hasil pilpres nyata final bangsa indonesia penting lantik presiden wakil presiden tanggal 20 oktober 2024
Pelantikan Masoud Pezeshkian sbg Presiden ke-9 Iran Selasa (30/7/2024) pukul 16:00 di ruang sidang terbuka Parlemen dihadiri 70 delegasi asing dan para pemimpin lembaga internasional. (Foto: Pezeshkian mencium Al Quran yg dipegang putrinya sbg tabaruk memulai tugas). https://t.co/LDOL7sqIen,lantik masoud pezeshkian sbg presiden 9 iran selasa 30 7 2024 16 00 ruang sidang buka parlemen hadir 70 delegasi asing pimpin lembaga internasional foto pezeshkian cium al quran yg pegang putri sbg tabaruk tugas
 Nusantara Baru Indonesia Maju menandai awal tiga transisi besar Indonesia: penyambutan ibu kota baru pergantian kepemimpinan dan persiapan menuju Indonesia Emas 2045. Hari ini untuk pertama kalinya dalam sejarah Upacara Peringatan Detik-Detik Proklamasi dalam rangka HUT https://t.co/BpUvajBTwT,nusantara indonesia maju tanda transisi indonesia sambut kota ganti pimpin siap indonesia emas 2045 kali sejarah upacara ingat detik detik proklamasi rangka hut
BREAKING: KPU RI resmi menetapkan Prabowo Subianto &amp; Gibran Rakabuming Raka sebagai presiden dan wakil presiden terpilih 2024. https://t.co/uMcSNruCEx,breaking kpu ri resmi tetap prabowo subianto amp gibran rakabuming raka presiden wakil presiden pilih 2024
Prabowo udh ada jadwal pelantikan tanggal 20 Otober 2024 di gedung DPR/ MPR. Anies yg masih jadi gelandangan politik. https://t.co/RRcrZaI7SI,prabowo udh jadwal lantik tanggal 20 otober 2024 gedung dpr mpr anies yg gelandang politik
Alhamdulillah hari ini Prabowo-Gibran telah resmi ditetapkan oleh KPU sebagai Presiden dan Wakil Presiden terpilih periode 2024-2029. Terima kasih kepada seluruh rakyat Indonesia penyelenggara pemilu tokoh agama prajurit TNI dan Polri relawan serta rekan-rekan pers yang https://t.co/qbGaONNi67,alhamdulillah prabowo gibran resmi tetap kpu presiden wakil presiden pilih periode 2024 2029 terima kasih rakyat indonesia selenggara milu tokoh agama prajurit tni polri rawan rekan rekan pers
Jika tidak bohong lagi nanti tgl 28 Juli 2024 IKN (Istana Kepresidenan Nusantara) akan mulai dipakai oleh Presiden. Kita do'akan semoga beliau kerasan di sana dan tidak berfikir utk pindah lagi ke Jakarta sampai Purna Tugasnya. https://t.co/o5iCYoN9aG,bohong tgl 28 juli 2024 ikn istana presiden nusantara pakai presiden do moga beliau kerasan berfikir utk pindah jakarta purna tugas
Pada tanggal 31 Juli 2024 Ismail Haniyeh gugur di Teheran Iran setelah menghadiri pelantikan Presiden Iran Masoud Pezeshkian. Berdasarkan berita dari @kumparan beliau tewas akibat rudal dari luar Iran diduga kuat berasal dari Israel. Tautan berita: https://t.co/fPWYq3NJvz https://t.co/TfhT0CarUU,tanggal 31 juli 2024 ismail haniyeh gugur teheran iran hadir lantik presiden iran masoud pezeshkian dasar berita beliau tewas akibat rudal iran duga kuat asal israel taut berita
Menghitung hari yang makin dekat dengan pelantikan presiden 20 okt mendatang beban berat amanat rakyat Indonesia akan segera ditanggung oleh Presiden terpilih Bapak Jendral TNI (Purn) Prabowo Subianto. Stabilitas keamanan mutlak dilakukan agar proses transisi perpindahan https://t.co/UWwGbRUWhL,hitung lantik presiden 20 okt beban berat amanat rakyat indonesia tanggung presiden pilih jendral tni purn prabowo subianto stabilitas aman mutlak proses transisi pindah
Nasib Jokowi dan Koalisi Indonesia Maju Pasca Pelantikan Presiden Baru https://t.co/1CJXTF95ZT https://t.co/YqoRySawz1,nasib jokowi koalisi indonesia maju pasca lantik presiden
Indonesia begitu penting di mata negara Australia. Bahkan pemimpin negara tersebut secara langsung mengucapkan selamat kepada Presiden terpilih @Prabowo atas kemenangan beliau di pilpres 2024 seraya berjanji akan menghadiri pelantikan presiden 20 okt 2024 mendatang. Sebagai https://t.co/B1ufVUy3Qy,indonesia mata negara australia pimpin negara langsung selamat presiden pilih menang beliau pilpres 2024 seraya janji hadir lantik presiden 20 okt 2024
@abwnewsco Setelah rapat DPR mengumumkan Anies Baswedan resmi menjadi presiden RI periode 2024 -2029,rapat dpr umum anies baswedan resmi presiden ri periode 2024 2029
Selain agenda reshuffle menteri Presiden Joko Widodo juga melantik tiga kepala lembaga. Pelantikan itu dilakukan bersamaan dengan perombakan Kabinet Indonesia Maju yang dilaksanakan di Istana Negara Jakarta Senin (19/8/2024). Kepala badan yang dilantik oleh Presiden Joko https://t.co/ob5YaAd2MP,agenda reshuffle menteri presiden joko widodo lantik kepala lembaga lantik sama ombak kabinet indonesia maju laksana istana negara jakarta senin 19 8 2024 kepala badan lantik presiden joko
Jatinangor (01/08/2024) - Pelantikan Pamong Praja Muda Angkatan XXXI oleh Wakil Presiden Republik Indonesia Bapak Prof. Dr. KH. Ma ruf Amin https://t.co/OcTTFDVHrS,jatinangor 01 08 2024 lantik pamong praja muda angkat xxxi wakil presiden republik indonesia prof dr kh ma ruf amin
 Prabowo Akan Dilantik Sebagai Presiden di Senayan/Jakarta Bukan IKN kata Sekjend Gerindra A Muzani. Itu sesuai ketentuan UUDNRI 1945 psl 3 ayat 2 dan psl 2 ayat 2. Karena belum ada Kepres yang pindahkan Ibukota RI dari Jakarta sesuai UU IKN maupun DKJ. https://t.co/r0nNaKP4GE,prabowo lantik presiden senayan jakarta ikn sekjend gerindra a muzani sesuai tentu uudnri 1945 psl 3 ayat 2 psl 2 ayat 2 pres pindah ibukota ri jakarta sesuai uu ikn dkj
Ahmad Muzani Wakil Ketua MPR mengonfirmasi bahwa pelantikan Prabowo Subianto sebagai Presiden Indonesia 2024-2029 akan tetap berlangsung di Gedung DPR/MPR Jakarta bukan di Ibu Kota Nusantara Kalimantan Timur seperti yang sebelumnya diantisipasi. https://t.co/H1cwcjM8UC,ahmad muzani wakil ketua mpr konfirmasi lantik prabowo subianto presiden indonesia 2024 2029 gedung dpr mpr jakarta kota nusantara kalimantan timur antisipasi
Gerakan perubahan itu tidak perlu menunggu pelantikan presiden atau dideklarasikannya partai perubahan Indonesia atau apapun namanya. Kita perlu memulai gerakan perubahan sejak sekarang ini. Jangan lewat momen Pilkada 2024 untuk mengikat para kandidat dengan kontrak politik.,gera ubah tunggu lantik presiden deklarasi partai ubah indonesia apa nama gera ubah momen pilkada 2024 ikat kandidat kontrak politik
Presiden Joko Widodo (Jokowi) dipastikan bakal melakukan perombakan atau reshuffle Kabinet Indonesia Maju pada pagi ini Senin (19/8/2024). Sejumlah menteri Jokowi pun sudah nampak hadir dalam upacara pelantikan tersebut. Simak informasi selengkapnya di Bisniscom atau klik https://t.co/zmgX5Gefek,presiden joko widodo jokowi ombak reshuffle kabinet indonesia maju pagi senin 19 8 2024 menteri jokowi nampak hadir upacara lantik simak informasi lengkap bisniscom klik
Hai #SobatKamla Jelang pelantikan Presiden dan Wakil Presiden RI Periode 2024 - 2029 MPR RI menggelar rangkaian sidang yang menjadi bagian dari proses pergantian kepemimpinan nasional. Mari saksikan bersama-sama di channel TV nasional kesayangan #SobatKamla! #BakamlaRI https://t.co/E6NmQNTwvD,hai sobatkamla jelang lantik presiden wakil presiden ri periode 2024 2029 mpr ri gelar rangkai sidang proses ganti pimpin nasional mari saksi channel tv nasional sayang sobatkamla bakamlari
Hari ini Kamis 12/9/2024 presiden mulai berkantor di Ibu Kota Nusantara ( IKN ). Sejumlah pejabat ikut serta termasuk sekretaris kabinet Pramono Anung yg juga cagub Jakarta. Jakarta akan sepi hanya tinggal Anies seorang https://t.co/3HspGq3r8D,kamis 12 9 2024 presiden kantor kota nusantara ikn jabat sekretaris kabinet pramono anung yg cagub jakarta jakarta sepi tinggal anies
Menyambung hal ini Albanese mengatakan ia berharap dapat menghadiri pelantikan presiden Indonesia pada Oktober 2024.,sambung albanese harap hadir lantik presiden indonesia oktober 2024
Menyambung hal ini Albanese mengatakan ia berharap dapat menghadiri pelantikan presiden Indonesia pada Oktober 2024.,sambung albanese harap hadir lantik presiden indonesia oktober 2024
Prabowo-Gibran Jadi Presiden-Wapres Terpilih Rapat Pleno KPU Ditutup https://t.co/9MWNAsxWoL,prabowo gibran presiden wapres pilih rapat pleno kpu tutup
58% Rakyat Indonesia sdh memilih Bapak Prabowo sbg Presiden RI 2024-2029 (tunggu Pelantikan) saran Sy lebih baik Bapak Jokowi berakhir dg husnul hotimah jadi gak usah cawe2 lagi Pemerintahan akan datang qiqi,58 rakyat indonesia sdh pilih prabowo sbg presiden ri 2024 2029 tunggu lantik saran sy jokowi dg husnul hotimah gak cawe2 perintah qiqi
Sejarah Baru Indonesia Memiliki FUFUFAFA Sebagai Wakil Presiden Tgl 20 Oktober 2024 Pelantikan Presiden dan Wakil Presiden Republik Indonesia,sejarah indonesia milik fufufafa wakil presiden tgl 20 oktober 2024 lantik presiden wakil presiden republik indonesia
Presiden Batal Berkantor ke IKN dan Prabowo Dilantik di Jakarta Apa Kabar Ibu Kota Baru? https://t.co/JnmuO6fqfB,presiden batal kantor ikn prabowo lantik jakarta kabar kota
Pengucapan sumpah pelantikan Presiden baru Iran Masoud Pezeshkian Selasa (30/7/2024) di Majelis Syura Islam Iran. https://t.co/P1woolsdhl,ucap sumpah lantik presiden iran masoud pezeshkian selasa 30 7 2024 majelis syura islam iran
40 hari menjelang purna tugas dan pelantikan pak @prabowo dan mas @gibran_tweet Presiden @jokowi akan berkantor di Istana Negara IKN 🇮🇩 Sehat sllu bapak Presiden terbaik yg pernah ada https://t.co/Ba08CEiqs3,40 jelang purna tugas lantik mas presiden kantor istana negara ikn sehat sllu presiden baik yg
Pelantikan Mensos dan BNPT Rabu (11/9/2024) pada kabinet Indonesia Maju di Istana Negara https://t.co/v02R38wAke,lantik mensos bnpt rabu 11 9 2024 kabinet indonesia maju istana negara
RATING PRABOWO diturunin ASING .... Jakarta CNBC Indonesia - Morgan Stanley menurunkan peringkat investasi di pasar modal Indonesia karena alasan pelemahan rupiah dan beban fiskal yang menantang jelang pelantikan presiden terpilih RI 2024-2029 Prabowo Subianto.,rating prabowo diturunin asing jakarta cnbc indonesia morgan stanley turun peringkat investasi pasar modal indonesia alas lemah rupiah beban fiskal tantang jelang lantik presiden pilih ri 2024 2029 prabowo subianto
Ptsan MK yg final &amp; mngikat trkait hasil pilpres 2024 resmi tlah dibacakn. Mari kita terima apa adanya dg sikap hormat &amp; kedepankn smangat kbangsaan utk kmbali rukun mmbangun Indonesia dg kepemimpinan baru pres&amp;wapres Prabowo-Gibran mulai 20 Okt 24 yad. Selamat utk kita semua!!,ptsan mk yg final amp mngikat trkait hasil pilpres 2024 resmi tlah dibacakn mari terima dg sikap hormat amp kedepankn smangat kbangsaan utk kmbali rukun mmbangun indonesia dg pimpin pres amp wapres prabowo gibran 20 okt 24 yad selamat utk
Upacara Pelantikan Presiden Taiwan 2024 Hadirkan 9 Pertunjukan Spektakuler #taipei #台北 #taiwan #台灣 #berita #pilprestaiwan https://t.co/ajKhRJYYoF,upacara lantik presiden taiwan 2024 hadir 9 tunjuk spektakuler taipei  taiwan  berita pilprestaiwan
Selamat pagi Sahabat Kompas. Presiden Joko Widodo akan menjalankan sejumlah agenda rutin pemerintahan di Ibu Kota Nusantara. Sidang kabinet paripurna membahas transisi pemerintahan juga akan digelar di Nusantara. Baca selengkapnya di sini https://t.co/LhJ5ulEARp #Polhuk https://t.co/MmPshd68Ew,selamat pagi sahabat kompas presiden joko widodo jalan agenda rutin perintah kota nusantara sidang kabinet paripurna bahas transisi perintah gelar nusantara baca lengkap polhuk
Moment... Prabowo Ngeledek (Ngejek?) Anies - Muhaimin Saat Pidato Di Acara Penetapan Presiden 2024-2029. Gedung KPU Rabu (24/4/2024). . https://t.co/3C45WmHCsD .. https://t.co/BrLNKq0xzy,moment prabowo ngeledek ngejek anies muhaimin pidato acara tetap presiden 2024 2029 gedung kpu rabu 24 4 2024
Presiden Joko Widodo melantik Menteri Sosial definitif menggantikan Tri Rismaharini yang kini maju di kontestasi Pilkada 2024. Jokowi menunjuk Syaifullah Yusuf dan melantiknya di Istana Negara Jakarta sekitar pukul 09.00 WIB. (Diah Dewi/BaliPost) https://t.co/q8aMXYo2JF,presiden joko widodo lantik menteri sosial definitif ganti tri rismaharini maju kontestasi pilkada 2024 jokowi syaifullah yusuf lantik istana negara jakarta 09 00 wib diah dewi balipost
Selamat Prabowo-Gibran yg sudah dimenangkan MK &amp; dilantik KPU sebagai Presiden &amp; Wakil Presiden Republik Indonesia 2024-2029 tinggal nunggu PTUN &amp; Angket klo jadi. Semoga semua berjalan baik2 saja. ,selamat prabowo gibran yg menang mk amp lantik kpu presiden amp wakil presiden republik indonesia 2024 2029 tinggal nunggu ptun amp angket klo moga jalan baik2
Ini dilakukan Prabowo Subianto setelah berpidato atas penetapan dirinya sebagai Presiden terpilih oleh KPU Rabu (24/4/2024). Prabowo Subianto dan Gibran Rakabuming Raka resmi ditetapkan sebagai Presiden dan Wakil Presiden terpilih oleh KPU. | Narasi Daily https://t.co/1vGQlv3i2S,prabowo subianto pidato tetap presiden pilih kpu rabu 24 4 2024 prabowo subianto gibran rakabuming raka resmi tetap presiden wakil presiden pilih kpu narasi daily
Momen gemas ketika Prabowo dan Gibran yang sudah resmi ditetapkan sebagai Presiden dan Wakil Presiden ini bersalaman dengan Anies dan Cak Imin. tt/yogiramons https://t.co/oOYczbPsmP,momen gemas prabowo gibran resmi tetap presiden wakil presiden salam anies cak imin tt yogiramons
Jgn lupa bang miduk datang ke pelantikan presiden KAMI yg baru tgl 20 oktober 2024 nanti mudah2han presiden baru nanti diberkati Tuhan agar Indonesia kita semakin berjaya salam damai bang miduk,jgn lupa bang miduk lantik presiden yg tgl 20 oktober 2024 mudah2han presiden kati tuhan indonesia jaya salam damai bang miduk
 BREAKING NEWS : KPU resmi menetapkan Prabowo Subianto dan Gibran Rakabuming Raka sebagai presiden dan wakil presiden terpilih Indonesia 2024-2029. 🇮🇩 https://t.co/zl9yAHua6q,breaking news kpu resmi tetap prabowo subianto gibran rakabuming raka presiden wakil presiden pilih indonesia 2024 2029
Ibu negara Iriana Joko Widodo berpamitan saat menghadiri acara Sosialisasi Moderat Sejak Dini di Balikpapan pada Rabu (11/9/2024). Iriana pamit karena akan purnatugas pada 20 Oktober 2024 mendatang. . #jokowi #iriana #balikpapan #prmn https://t.co/0ZDwdHbU0P,negara iriana joko widodo pamit hadir acara sosialisasi moderat balikpapan rabu 11 9 2024 iriana pamit purnatugas 20 oktober 2024 jokowi iriana balikpapan prmn
Presiden terpilih Prabowo Subianto mengaku Joko Widodo atau Jokowi telah mempersiapkan dirinya untuk menjadi Presiden. Hal tersebut diungkapkannya saat melakukan sambutan di acara Halalbihalal Pengurus Besar Nahdlatul Ulama (PBNU) di Kantor PBNU Senen Jakarta Pusat Minggu https://t.co/yppZNszVKe,presiden pilih prabowo subianto aku joko widodo jokowi presiden ungkap sambut acara halalbihalal urus nahdlatul ulama pbnu kantor pbnu senen jakarta pusat minggu
@Penyuka_ombak Datang ya ke pelantikan presiden KAMI tgl 20 oktober 2024 nah 2029 kita jumpa lg dlm bentuk satu suara semoga presiden kami dpt membawa Indonesia lebih maju entar kalo presiden kami melenceng kita sama2 mengkritik kearah lebih positif.amin,ya lantik presiden tgl 20 oktober 2024 2029 jumpa lg dlm bentuk suara moga presiden dpt bawa indonesia maju entar kalo presiden lenceng sama2 kritik arah positif amin
oh jadi day6 gabisa konser di Indonesia Arena karena sterilisasi untuk pelantikan presiden 2024. padahal venue IA mendukung bgt buat konseran dr bcis ,oh day6 gabisa konser indonesia arena sterilisasi lantik presiden 2024 venue dukung bgt konser dr bcis
Presiden Republik Indonesia Joko Widodo (Jokowi) melantik Marsekal Madya (Marsdya) TNI Mohamad Tonny Harjono sebagai Kepala Staf Angkatan Udara (KSAU) Jumat 5 April 2024 di Istana Negara Jakarta. . Pelantikan tersebut berdasarkan kepada Keputusan Presiden (Keppres) Nomor https://t.co/0qLGq6JV5U,presiden republik indonesia joko widodo jokowi lantik marsekal madya marsdya tni mohamad tonny harjono kepala staf angkat udara ksau jumat 5 april 2024 istana negara jakarta lantik dasar putus presiden keppres nomor
Mengenai alasan pengunduran diri Gibran mengatakan salah satunya untuk persiapan pelantikan Presiden dan Wakil Presiden Terpilih pada 20 Oktober 2024 https://t.co/lZ3Aad1v6k,alas undur gibran salah satu siap lantik presiden wakil presiden pilih 20 oktober 2024
Anies Baswedan dan Muhaimin Iskandar mengucapkan selamat kepada presiden terpilih Prabowo Subianto dan wakil presiden terpilih Gibran Rakabuming Raka. Ucapan ini disampaikan usai putusan Mahkamah Konstitusi (MK). #SuaraPenentu | Narasi Daily https://t.co/afUOKtBSHh,anies baswedan muhaimin iskandar selamat presiden pilih prabowo subianto wakil presiden pilih gibran rakabuming raka ucap putus mahkamah konstitusi mk suarapenentu narasi daily
2. Pelantikan tsb digelar berdasarkan Surat Keputusan Presiden Republik Indonesia No. 20/TNI/Tahun 2024 tanggal 25 Maret 2024 tentang Pemberhentian dan Pengangkatan Kepala Staf Angkatan Udara. M. Tonny Harjono menggantikan Marsekal TNI Fadjar Prasetyo yang memasuki masa pensiun. https://t.co/hxsw6VKnfl,2 lantik tsb gelar dasar surat putus presiden republik indonesia no 20 tni 2024 tanggal 25 maret 2024 henti angkat kepala staf angkat udara m tonny harjono ganti marsekal tni fadjar prasetyo pasuk pensiun
MULYONO SUDAH TERSUDUT... . . Perhatikan dua tanggal penting ini : * 12 September 2024 : Para Kapolres Kapolda Kapolri dikumpulkan di Ibu Kota Nusantara (IKN) untuk mendengarkan arahan presiden. https://t.co/TsSWakHYbZ,mulyono sudut perhati tanggal 12 september 2024 kapolres kapolda kapolri kumpul kota nusantara ikn dengar arah presiden
Beberapa kejadian menarik sudah mewarnai bulan ini mulai dari kabar Piala AFF U-16 2024 hingga Kabar Pelantikan Presiden Republik Indonesia. https://t.co/bDbFhkzq7A,jadi tarik warna kabar piala aff u 16 2024 kabar lantik presiden republik indonesia
Anwar juga mendoakan agar Pilkada serentak 2024 di Indonesia berjalan baik serta pelantikan Prabowo sebagai Presiden RI berjalan lancar.,anwar doa pilkada serentak 2024 indonesia jalan lantik prabowo presiden ri jalan lancar
Pak Prabowo dilantik jadi Presiden 20 Okt 2024. Kubu 01+03 terus pertanyakan janji kampanye. Seharusnya yg berhak tagih janji adalah para rakyat pemilihnya terlebih dahulu. Kenapa yg rewel tidak memilihnya? Ngiler ya? Ingin ikutan merasakan janji PS sebenarnya tapi malu? https://t.co/QS6zJLmKGj,prabowo lantik presiden 20 okt 2024 kubu 01 03 janji kampanye yg hak tagih janji rakyat pilih yg rewel pilih ngiler ya ikut rasa janji ps malu
4. Selain itu Presiden Jokowi juga melantik Angga Raka Prabowo sebagai Wakil Menteri Komunikasi dan Informatika. Pelantikan tersebut didasarkan pada Keputusan Presiden Republik Indonesia Nomor 52/M Tahun 2024 tentang Pengangkatan Wakil Menteri Komunikasi dan Informatika https://t.co/dlYiTEF5hi,4 presiden jokowi lantik angga raka prabowo wakil menteri komunikasi informatika lantik dasar putus presiden republik indonesia nomor 52 m 2024 angkat wakil menteri komunikasi informatika
Pemilu di Indonesia ini sangat merugikan rakyat pelaku usaha mikro dan makro. Yang paling kena dampak itu usaha mikro (UMKM) hampir semua pengusaha belum mau keluarkan uang utk belanja karena nunggu pelantikan presiden bulan oktober 2024 Sementara itu.. #politiktaikucing,milu indonesia rugi rakyat laku usaha mikro makro kena dampak usaha mikro umkm usaha keluar uang utk belanja nunggu lantik presiden oktober 2024 politiktaikucing
Cawapres nomor urut 2 Gibran Rakabuming Raka berencana merangkul dua lawannya di Pilpres 2024 pasangan 01 Anies Baswedan-Muhaimin Iskandar dan 03 Ganjar Pranowo-Mahfud Md untuk bergabung di pemerintahan usai KPU mengumumkan secara resmi hasil Pemilu 2024. Ya semuanya https://t.co/jNFoUnIZq1,cawapres nomor urut 2 gibran rakabuming raka rencana rangkul lawan pilpres 2024 pasang 01 anies baswedan muhaimin iskandar 03 ganjar pranowo mahfud md gabung perintah kpu umum resmi hasil milu 2024 ya
 Pertemuan dengan sahabat karib saya Presiden terpilih Indonesia Prabowo Subianto sangat menggembirakan. Saya merasa terhormat menerima undangannya untuk hadir pada pelantikan Presiden Indonesia yang akan diadakan pada 20 Oktober 2024 di Jakarta tulis Anwar,temu sahabat karib presiden pilih indonesia prabowo subianto gembira hormat terima undang hadir lantik presiden indonesia ada 20 oktober 2024 jakarta tulis anwar
Nasib Jokowi dan Koalisi Indonesia Maju Pasca Pelantikan Presiden Baru https://t.co/CWV97qM65P,nasib jokowi koalisi indonesia maju pasca lantik presiden
2. Pelantikan ini berdasarkan Keputusan Presiden Republik Indonesia Nomor 74/TPA Tahun 2024 tentang Pejabat Pimpinan Tinggi Madya di Lingkungan Kementerian Sekretariat Negara. Sumber: Humas Kemensetneg #KemensetnegRI #RilisKemensetneg https://t.co/rcE9kxpyUL,2 lantik dasar putus presiden republik indonesia nomor 74 tpa 2024 jabat pimpin madya lingkung menteri sekretariat negara sumber humas kemensetneg kemensetnegri riliskemensetneg
TERBARU!! BERSAMA kami MENANG!! Pelantikan Presiden Putin 7 Mei 2024 Bahasa Indonesia (Paunchy) https://t.co/8cSanXGGoM,baru menang lantik presiden putin 7 mei 2024 bahasa indonesia paunchy
1. Presiden Joko Widodo secara resmi melantik tiga jabatan menteri dan satu wakil menteri Kabinet Indonesia Maju dalam sisa masa jabatan periode tahun 2019-2024. Acara pelantikan tersebut digelar di Istana Negara Jakarta (19/8). https://t.co/SvLS6Bmfdq,1 presiden joko widodo resmi lantik jabat menteri wakil menteri kabinet indonesia maju sisa jabat periode 2019 2024 acara lantik gelar istana negara jakarta 19 8
Sekjen Pengurus Besar Nahdlatul Ulama (PBNU) Saifullah Yusuf atau Gus Ipul resmi dilantik jadi Menteri Sosial (Mensos) untuk menggantikan Tri Rismaharini yang mundur usai daftar calon gubernur Jawa Timur. Presiden @jokowi memimpin langsung pelantikan untuk mengambil sumpah https://t.co/oM6uATZ4Y8,sekjen urus nahdlatul ulama pbnu saifullah yusuf gus ipul resmi lantik menteri sosial mensos ganti tri rismaharini mundur daftar calon gubernur jawa timur presiden pimpin langsung lantik ambil sumpah
@msaid_didu Jgn terlalu panik dulu Om. Tunggu pelantikan Presiden RI yg ke-8 20 Okt 2024 nanti apa yg terjadi setelahnya Insya Allah Indonesia akan jauh lebih baik. Amin. ,jgn panik om tunggu lantik presiden ri yg 8 20 okt 2024 yg telah insya allah indonesia amin
Prabowo Akan Dilantik Sebagai Presiden di Senayan Bukan IKN https://t.co/lO6nC5pONS,prabowo lantik presiden senayan ikn
