full_text,final_cleaned_text
Jelang pelantikan presiden pada 20 Oktober 2024 PKS mulai dekati Partai Gerindra. PKS ngarep diajak masuk kabinet Prabowo Subianto-Gibran Rakabuming Raka. https://t.co/h6563WdyVD #PKS #prabowogibran https://t.co/ew4sAw43YA,jelang lantik presiden 20 oktober 2024 pks dekat partai gerindra pks ngarep ajak masuk kabinet prabowo subianto gibran rakabuming raka pks prabowogibran
Lima orang mengajukan permohonan uji materi ke Mahkamah Konstitusi (MK) meminta pelantikan Presiden serta Wakil Presiden terpilih Prabowo Subianto-Gibran Rakabuming Raka dipercepat. Paling lambat tiga bulan setelah KPU mengumumkan pemenang Pilpres 2024. https://t.co/dy82dlF79a https://t.co/Knivqq7pxR,orang aju mohon uji materi mahkamah konstitusi mk lantik presiden wakil presiden pilih prabowo subianto gibran rakabuming raka cepat lambat kpu umum menang pilpres 2024
Presiden Joko Widodo melantik politikus Partai Gerindra Angga Raka Prabowo menjadi Wakil Menteri Komunikasi dan Informatika (Wamenkominfo). Pelantikan berlangsung di Istana Negara Jakarta Senin (19/8/2024). Ini profil Angga Raka Prabowo #prabowo #gibran #prabowogibran https://t.co/00XvS0rY4T,presiden joko widodo lantik politikus partai gerindra angga raka prabowo wakil menteri komunikasi informatika wamenkominfo lantik istana negara jakarta senin 19 8 2024 profil angga raka prabowo prabowo gibran prabowogibran
Indonesia Kebal Resesi 2024 Prabowo Optimis Menjelang Pelantikan Presiden Oktober Oleh: Willem Wandik S.Sos (Dewan Pakar TKN Prabowo Gibran Ketua MPO DPP GAMKI Anggota DPR RI Fraksi PD) Optimisme Indonesia dalam menghadapi ancaman resesi global di Tahun 2024 itu tidaklah https://t.co/S590r7yR7V,indonesia kebal resesi 2024 prabowo optimis jelang lantik presiden oktober willem wandik s sos dewan pakar tkn prabowo gibran ketua mpo dpp gamki anggota dpr ri fraksi pd optimisme indonesia hadap ancam resesi global 2024
Menko Marves Luhut Binsar Pandjaitan bercerita bahwa Presiden terpilih Prabowo Subianto akan mengumumkan susunan menteri kabinetnya pada 21 Oktober 2024. Luhut menyebut Prabowo telah menyiapkan segala sesuatunya dengan sistematis. #prabowo #gibran #prabowogibran #pelantikan https://t.co/DqaFMUECy1,menko marves luhut binsar pandjaitan cerita presiden pilih prabowo subianto umum susun menteri kabinet 21 oktober 2024 luhut sebut prabowo sistematis prabowo gibran prabowogibran lantik
Sudahi semua jangan bikin gaduh terus 20 Oktober 2024 Prabowo Gibran dilantik menjadi presiden kita presiden seluruh rakyat Indonesia Milik kita semua bukan milik yg milih saja kok Mengakui atau tidak akui mereka berdua adalah presiden yang sah dan dipilih secara demokratis https://t.co/J2ifWGv5KV,sudah bikin gaduh 20 oktober 2024 prabowo gibran lantik presiden presiden rakyat indonesia milik milik yg milih aku aku dua presiden sah pilih demokratis
 Tidak ada celah untuk menunda atau membatalkan pelantikan Prabowo-Gibran karena Pemilu 2024 sudah selesai keputusan MK dan ketetapan KPU atas hasil Pilpres pun sudah jelas Ketua MPR RI Bambang Soesatyo https://t.co/OiR1jZb1F3 #partaigolkar #golkarindonesia #golkarpedia https://t.co/wy4tcRX3TI,celah tunda batal lantik prabowo gibran milu 2024 selesai putus mk tetap kpu hasil pilpres ketua mpr ri bambang soesatyo partaigolkar golkarindonesia golkarpedia
 Prabowo-Gibran Batal Dilantik oleh MPR Ketua MPR Bambang Soesatyo mengatakan pelantikan presiden dan wakil presiden terpilih sulit untuk dijegal karena tahapan Pemilu 2024 sudah selesai. Selengkapnya di https://t.co/9Rui5RNrxM #LawanHoax #TurnBackHoax #MAFINDO https://t.co/k2Fsonsvxb,prabowo gibran batal lantik mpr ketua mpr bambang soesatyo lantik presiden wakil presiden pilih sulit jegal tahap milu 2024 selesai lengkap lawanhoax turnbackhoax mafindo
SELAMAT ATAS TERPILIHNYA PRABOWO SUBIANTO DAN GIBRAN RAKABUMING RAKA SEBAGAI PRESIDEN DAN WAKIL PRESIDEN REPUBLIK INDONESIA PERIODE 2024 - 2029🇲🇨 #PrabowoGibranMenangTelak YesPakBowo YesCampeones @prabowo @gibran_tweet https://t.co/q98UQDOjk6,selamat pilih prabowo subianto gibran rakabuming raka presiden wakil presiden republik indonesia periode 2024 2029 prabowogibranmenangtelak yespakbowo yescampeones
Sekali lagi selamat untuk Bapak @prabowo dan Mas @gibran_tweet yang telah ditetapkan oleh @KPU_ID sebagai pemenang pemilihan Presiden dan Wakil Presiden 2024 - 2029. Semoga sukses dan lancar sampai dengan pelantikan pada 20 oktober 2024 mendatang. https://t.co/a5hqiY1UqB,selamat mas tetap menang pilih presiden wakil presiden 2024 2029 moga sukses lancar lantik 20 oktober 2024
Analisis Sukses atau Tidaknya Pelantikan Presiden Prabowo-Gibran https://t.co/I3Rv5gjIAi https://t.co/34L0Lkq4Dl,analisis sukses tidak lantik presiden prabowo gibran
Beredar Draft susunan Menteri Kabinet Prabowo Gibran 2024 - 2029 Semoga sesuai harapan Netizen &gt;&gt;&gt; https://t.co/sTFM14QxMP,edar draft susun menteri kabinet prabowo gibran 2024 2029 moga sesuai harap netizen gt gt gt
Prabowo Gibran adalah pilihan politik 58% pengguna hak pilih dlm pilpres 2024 jadi sulit pelantikan presiden Prabowo di tunda Krn dampak kerugian sosial politik ekonomi nya yg merasakan adalah masyarakat kalo elit politik ya tdk berdampak apapun Krn elit bersama dlm ksejahteraan,prabowo gibran pilih politik 58 guna hak pilih dlm pilpres 2024 sulit lantik presiden prabowo tunda krn dampak rugi sosial politik ekonomi nya yg rasa masyarakat kalo elit politik ya tdk dampak apa krn elit dlm ksejahteraan
Ketum PPJNA 98: Waspadai Sabotase untuk Gagalkan Pelantikan Prabowo-Gibran https://t.co/0zRNho7gli https://t.co/P0eXavz1EA,tum ppjna 98 waspada sabotase gagal lantik prabowo gibran
Pun pelantikan Prabowo - Gibran sebagai Presiden dan Wakil Presiden Republik Indonesia 2024 - 2029 dijamin pasti akan berjalan sesuai jadwal yakni 20 Oktober 2024. Dan ini menjawab marah banyak pihak yang tak pernah bosan berusaha membenturkan Prabowo dan Jokowi dengan https://t.co/FMfd9TrD1v,lantik prabowo gibran presiden wakil presiden republik indonesia 2024 2029 jamin jalan sesuai jadwal 20 oktober 2024 marah bosan usaha bentur prabowo jokowi
SIDANG PENDAHULUAN DI PTUN TIM HUKUM PDIP PELANTIKAN PRABOWO-GIBRAN DITUNDA....‼️ #2024REVOLUSIRakyat #2024REVOLUSIRakyat 🆘🆗 https://t.co/Z4VMIZX7BM,sidang dahulu ptun tim hukum pdip lantik prabowo gibran tunda 2024revolusirakyat 2024revolusirakyat
Lokasi Pelantikan Prabowo-Gibran Sebagai Presiden dan Wakil Presiden Periode 2024-2029 https://t.co/gqJ29oWRFZ,lokasi lantik prabowo gibran presiden wakil presiden periode 2024 2029
Ketua MPR RI Bambang Soesatyo menegaskan pelantikan presiden dan wakil presiden terpilih hasil Pemilu 2024 sangat sulit untuk dijegal. #prabowo #gibran #mpr #bamsoet #pdip #pilpres2024 #pelantikan #monitorday https://t.co/lVthBZB1Vi,ketua mpr ri bambang soesatyo lantik presiden wakil presiden pilih hasil milu 2024 sulit jegal prabowo gibran mpr bamsoet pdip pilpres2024 lantik monitorday
Andre Rosiade: Pelantikan Prabowo-Gibran 20 Oktober 2024 - https://t.co/dfnxGgZa19,andre rosiade lantik prabowo gibran 20 oktober 2024
Empat bulan jelang pelantikan Prabowo Subianto hadir dan berpidato di perhelatan Shangri-La Dialogue 2024 menemui beberapa menteri pertahanan hingga Presiden Ukraina Volodymyr Zelenskyy. #prabowo #gibran #prabowogibran #mendingprabowo #dekade08 https://t.co/Ezr4ZGDOzo,jelang lantik prabowo subianto hadir pidato helat shangri la dialogue 2024 temu menteri tahan presiden ukraina volodymyr zelenskyy prabowo gibran prabowogibran mendingprabowo dekade08
Draft Susunan Kabinet Prabowo - Gibran 2024 - 2029 https://t.co/fZdC188Mag,draft susun kabinet prabowo gibran 2024 2029
apa bener tanggal 20 oktober 2024 ada kejutan selain pelantikan prabowo gibran ? apa benar ada deklarasi partai baru bentukan anies ditanggal tersebut? apa benar ada gerakan aktivis dan mahasiswa deklarasi menjadi oposisi pemerintah baru? penasaran ,bener tanggal 20 oktober 2024 kejut lantik prabowo gibran deklarasi partai bentuk anies tanggal gera aktivis mahasiswa deklarasi oposisi perintah penasaran
Ketua Umum PDIP Megawati di-sebut2 Bakal Temui prabowo sebelum pelantikan Prabowo - Gibran pada 20 Oktober 2024 nanti. Benarkah...??!! Dalam Politik tidak ada Kawan &amp; Lawan yang abadi Yang ada hanya kepentingan abadi. Politik itu cair akar rumput jangan baper _ https://t.co/GcDUqVNors,ketua pdip megawati sebut2 temu prabowo lantik prabowo gibran 20 oktober 2024 politik kawan amp lawan abadi penting abadi politik cair akar rumput baper 
Kasus Fufufafa Gibran akan Dimasukkan 'Kotak' Oleh Prabowo setelah Pelantikan 20 Oktober 2024 https://t.co/azVQtJLUgd https://t.co/kzeQuYaMFj,fufufafa gibran masuk kotak prabowo lantik 20 oktober 2024
Ketua MPR Tegaskan Pelantikan Prabowo Gibran Jadi Presiden dan Wakil Presiden RI Tak Bisa Dijegal https://t.co/F5yJWuc47J,ketua mpr tegas lantik prabowo gibran presiden wakil presiden ri jegal
Prabowo Gibran torang gas lagu oke gas bikin semangattttttttttt. Selamat buat Prabowo Gibran menuju pelantikan bulan oktober 2024 https://t.co/gRlRdaD8zy,prabowo gibran torang gas lagu oke gas bikin semangattttttttttt selamat prabowo gibran lantik oktober 2024
YAKIN PRABOWO - GIBRAN BATAL DILANTIK ..?? Ketua Tim Hukum @PDI_Perjuangan Gayus Lumbuun Yakin Majelis Hakim PTUN Jakarta mengabulkan gugatan dan berharap MPR membatalkan pelantikan pasangan Prabowo-Gibran sebagai presiden dan wakil presiden periode 2024-2029. _ https://t.co/4FsVbvBDDe,prabowo gibran batal lantik ketua tim hukum gayus lumbuun majelis hakim ptun jakarta kabul gugat harap mpr batal lantik pasang prabowo gibran presiden wakil presiden periode 2024 2029 
Susunan Kabinet Prabowo-Gibran Rampung H-7 Pelantikan Partai Gerindra mengungkapkan susunan kabinet @prabowo-@gibran_tweet akan selesai disusun tujuh hingga lima hari sebelum pelantikan pada 20 Oktober 2024. Nomenklatur maupun nama-nama menteri mungkin baru akan final H-7 https://t.co/VGDDL0Orab,susun kabinet prabowo gibran rampung h 7 lantik partai gerindra susun kabinet selesai susun tujuh lantik 20 oktober 2024 nomenklatur nama nama menteri final h 7
Saifullah Yusuf alias Gus Ipul resmi menjadi menteri sosial per hari ini Rabu 11 September 2024. Masa jabatannya akan berakhir 39 hari lagi yakni sehari sebelum pelantikan presiden dan wakil presiden terpilih Prabowo-Gibran. https://t.co/kpV3sjMfjH,saifullah yusuf alias gus ipul resmi menteri sosial rabu 11 september 2024 jabat 39 hari lantik presiden wakil presiden pilih prabowo gibran
Pimpinan MPR Respon Gugatan PDIP Minta Batalkan Pelantikan Prabowo Gibran ke PTUN https://t.co/EFOZLjsBNQ,pimpin mpr respon gugat pdip batal lantik prabowo gibran ptun
Selamat atas terpilihnya bapak @prabowo Subianto dan mas @gibran_tweet Rakabuming Raka sebagai Presiden dan Wakil Presiden 2024-2029. https://t.co/7B5j7czSFR,selamat pilih subianto mas rakabuming raka presiden wakil presiden 2024 2029
Presiden Jokowi akan bekerja di IKN 40 hari mulai 11 September hingga 19 Oktober 2024 atau hingga sehari menjelang pelantikan Presiden dan Wakil Presiden terpilih Prabowo -Gibran PRABOWOJKW TetapSELARAS Selamat Hari Olahraga Nasional #JudolPerusak Erina Hubner Syahrini Gibran https://t.co/UJTK227Btl,presiden jokowi ikn 40 11 september 19 oktober 2024 hari jelang lantik presiden wakil presiden pilih prabowo gibran prabowojkw tetapselaras selamat olahraga nasional judolperusak erina hubner syahrini gibran
Putusan PTUN Tidak Bisa Menjegal Pelantikan Prabowo-Gibran https://t.co/LwjiPZ0Umd,putus ptun jegal lantik prabowo gibran
Sekretaris Jenderal Gerindra Ahmad Muzani mengatakan bahwa Ketua Umum PDIP Megawati Soekarnoputri dengan Presiden Terpilih Prabowo Subianto akan segera bertemu. . Pertemuan keduanya dijadwalkan terjadi sebelum pelantikan pemerintahan Prabowo-Gibran pada 20 Oktober 2024. . https://t.co/Ouwe3uajny,sekretaris jenderal gerindra ahmad muzani ketua pdip megawati soekarnoputri presiden pilih prabowo subianto temu temu jadwal lantik perintah prabowo gibran 20 oktober 2024
Siap pelantikan pasangan presiden 2024-2029 Prabowo dan Gibran. proses #Pemilu2024 sudah selesai. Kembali ke tugas pemerintahan dan rakyat dah. #IndonesiaEmas,lantik pasang presiden 2024 2029 prabowo gibran proses pemilu2024 selesai tugas perintah rakyat dah indonesiaemas
Komisi Pemilihan Umum Republik Indonesia (KPU RI) menetapkan Prabowo Subianto dan Gibran Rakabuming Raka sebagai Presiden dan Wakil Presiden Terpilih Pemilu 2024 pada Rabu (24/4/2024). Dengan demikian pasangan ini tinggal menunggu waktu pelantikan yang akan digelar pada 20 https://t.co/Lo2BT5K2f3,komisi pilih republik indonesia kpu ri tetap prabowo subianto gibran rakabuming raka presiden wakil presiden pilih milu 2024 rabu 24 4 2024 pasang tinggal tunggu lantik gelar 20
Gugatan PDIP tidak bisa batalkan pelantikan Prabowo Gibran. Rakyat Indonesia mendukung hasil putusan KPU terkait hasil Pemilu 2024. Jangan terprovokasi kelompok pemecah belah bangsa #pemilu2024 #pemiludamai #nohoax #IndonesiaMaju https://t.co/frjqLwOFgs,gugat pdip batal lantik prabowo gibran rakyat indonesia dukung hasil putus kpu kait hasil milu 2024 provokasi kelompok pecah belah bangsa pemilu2024 pemiludamai nohoax indonesiamaju
Daftar kaum sakit hati menjelang pelantikan Prabowo Gibran 2024 2029 lima tahun kayaknya lama : Motor pengerak partai PDIP dan para pengurus terasnya.....Hasto cs - Mahfud Anis Ganjar very amsari said Didu cs Gunawan Muhammad cs amin rasis cs pokok kelompok 17 % dan 24 %,daftar kaum sakit hati jelang lantik prabowo gibran 2024 2029 kayak motor erak partai pdip urus teras hasto cs mahfud anis ganjar very amsari said didu cs gunawan muhammad cs amin ras cs pokok kelompok 17 24
MPR tegaskan tak ada yang bisa gagalkan pelantikan Prabowo Gibran. Rakyat Indonesia mendukung hasil putusan KPU terkait hasil Pemilu 2024. Jangan terprovokasi kelompok pemecah belah bangsa #pemilu2024 #pemiludamai #nohoax #IndonesiaMaju https://t.co/2bJf1bUGQ2,mpr tegas gagal lantik prabowo gibran rakyat indonesia dukung hasil putus kpu kait hasil milu 2024 provokasi kelompok pecah belah bangsa pemilu2024 pemiludamai nohoax indonesiamaju
Gayus Lumbuun Sebut Gugatan PDIP ke PTUN Bisa Gagalkan Pelantikan Prabowo-Gibran https://t.co/6H6Xoqds6G,gayus lumbuun gugat pdip ptun gagal lantik prabowo gibran
Usai sudah tahapan pilpres 2024 tinggal menunggu pelantikan @prabowo @gibran_tweet sebagai presiden dan wakil presiden RI periode 2024 - 2029,tahap pilpres 2024 tinggal tunggu lantik presiden wakil presiden ri periode 2024 2029
'Jokowi Leda-Lede Pelantikan Prabowo-Gibran Dalam Bayang-Bayang Pelanggaran Konstitusi' https://t.co/UoL0yxalAH,jokowi leda lede lantik prabowo gibran bayang bayang langgar konstitusi
Gayus berpandangan berpeluang kemungkinan atau bisa saja pelantikan paslon Prabowo Subianto dan Gibran Rakabuming Raka sebagai Presiden dan Wakil Presiden terpilih 2024 ditunda apabila hakim di PTUN mengabulkan permohonan dari Tim Hukum PDIP. (ist) https://t.co/fEXZaSoG74,gayus pandang peluang lantik paslon prabowo subianto gibran rakabuming raka presiden wakil presiden pilih 2024 tunda hakim ptun kabul mohon tim hukum pdip ist
KPU telah resmi menetapkan Prabowo-Gibran sebagai Presiden dan Wakil Presiden terpilih untuk periode 2024-2029. Prabowo memiliki enam bulan untuk mempersiapkan pemerintahannya sebelum pelantikan pada Oktober mendatang. Muncul pertanyaan apakah Prabowo dapat merangkul partai https://t.co/SEmarSXAmn,kpu resmi tetap prabowo gibran presiden wakil presiden pilih periode 2024 2029 prabowo milik enam perintah lantik oktober muncul prabowo rangkul partai
20 Oktober 2024 : Pelantikan Prabowo-Gibran. Sekitar momen momen itu : akan gaduh dan gejolak aksi aksi lagi,20 oktober 2024 lantik prabowo gibran momen momen gaduh gejolak aksi aksi
Dalam langkah menuju masa depan yang baru penentuan dan pelantikan Prabowo-Gibran sebagai Presiden dan Wakil Presiden terpilih adalah titik penting. Setelah putusan MK KPU akan mengumumkan penetapan mereka pada Rabu 24 April 2024. https://t.co/YFWxOdh04A,langkah tentu lantik prabowo gibran presiden wakil presiden pilih titik putus mk kpu umum tetap rabu 24 april 2024
Mensesneg Diminta Segera Merampungkan Dokumen Keppres IKN Sebelum Pelantikan Prabowo-Gibran https://t.co/10XobHGNdR #beritajogja #jogja #jogjaistimewa https://t.co/TzRQHeVD3H,mensesneg rampung dokumen keppres ikn lantik prabowo gibran beritajogja jogja jogjaistimewa
Prabowo-Gibran Officially Declared President-Vice President for the 2024-2029 Term By KPU https://t.co/SN43ZO32zD,prabowo gibran officially declared president vice president for the 2024 2029 term by kpu
Kapan Pelantikan Presiden 2024? Jadwal Resmi dan Prediksi Susunan Kabinet Prabowo Gibran https://t.co/LolPJSX5r5,lantik presiden 2024 jadwal resmi prediksi susun kabinet prabowo gibran
Jadwal Pelantikan Presiden Terpilih 20 Oktober 2024 Ini Prediksi Susunan Kabinet Prabowo-Gibran https://t.co/QIItuN2Vkr,jadwal lantik presiden pilih 20 oktober 2024 prediksi susun kabinet prabowo gibran
Alhamdulillah hari ini Prabowo-Gibran telah resmi ditetapkan oleh KPU sebagai Presiden dan Wakil Presiden terpilih periode 2024-2029. Terima kasih kepada seluruh rakyat Indonesia penyelenggara pemilu tokoh agama prajurit TNI dan Polri relawan serta rekan-rekan pers yang https://t.co/qbGaONNi67,alhamdulillah prabowo gibran resmi tetap kpu presiden wakil presiden pilih periode 2024 2029 terima kasih rakyat indonesia selenggara milu tokoh agama prajurit tni polri rawan rekan rekan pers
Sidang Pendahuluan di PTUN Tim Hukum PDIP: Pelantikan Prabowo-Gibran Bisa Ditunda https://t.co/b3VECxy6b7,sidang dahulu ptun tim hukum pdip lantik prabowo gibran tunda
Pakar: Gugatan PDIP ke PTUN Tak Bisa Tunda Pelantikan Prabowo-Gibran https://t.co/4hW654cQsw,pakar gugat pdip ptun tunda lantik prabowo gibran
Saya pendukung 01 Anies Muhaimin pada pilpres 2024 sampai sekarang. Tapi saya tidak rela kalau Prabowo dan Indonesia diacak-acak oleh bocil Gibran. @_bemsi @DPR_RI 28 Juli 2024: Pasca Pelantikan Gibran Undurkan Diri? https://t.co/jxM1kynsTB #RakyatWajibTurunkanJokowi https://t.co/bNLWyeEGkh,dukung 01 anies muhaimin pilpres 2024 rela prabowo indonesia acak acak bocil gibran 28 juli 2024 pasca lantik gibran undur rakyatwajibturunkanjokowi
Sengketa Pilpres Selesai Andre Rosiade: Pelantikan Prabowo-Gibran 20 Oktober 2024 https://t.co/CqIt2jI0TM,sengketa pilpres selesai andre rosiade lantik prabowo gibran 20 oktober 2024
Inilah Peluang PDIP Jegal Pelantikan Prabowo-Gibran Lewat PTUN dan MPR Prabowo-Gibran Bisa Batal Diangkat? https://t.co/pFLBSsItyX,peluang pdip jegal lantik prabowo gibran ptun mpr prabowo gibran batal angkat
Maka Prabowo-Gibran akan menjabat sebagai presiden dan wakil presiden periode 2024-2029. Pelantikan rencananya digelar 20 Oktober 2024. https://t.co/YZavbJmlDm.,prabowo gibran jabat presiden wakil presiden periode 2024 2029 lantik rencana gelar 20 oktober 2024
Prabowo-Gibran Harus Persiapkan Diri Setelah Pelantikan Langsung Kerja... Termasuk Menghadapi Nyinyiran ex 01 yg Masih Tidak Nerima Kalah.... @prabowo @gibran_tweet https://t.co/oUDIJMWvdB,prabowo gibran siap lantik langsung kerja hadap nyinyir ex 01 yg nerima kalah
Politikus Partai Gerindra Maruarar Sirait berharap Anies Baswedan dan Ganjar Pranowo bisa menghadiri pelantikan Prabowo Subianto dan Gibran Rakabuming Raka pada Oktober 2024 mendatang. Pada Oktober 2024 Prabowo Subianto dan Gibran Rakabuming Raka akan dilantik sebagai presiden https://t.co/tAIOFYPvtd,politikus partai gerindra maruarar sirait harap anies baswedan ganjar pranowo hadir lantik prabowo subianto gibran rakabuming raka oktober 2024 oktober 2024 prabowo subianto gibran rakabuming raka lantik presiden
Saya bukan pendukung Pak Prabowo pada Pilpres 2014 Pilpres 2019 pun pada Pilpres 2024. Faktanya : tahun ini Pak Prabowo adalah Presiden RI terpilih dan pada Minggu 20 Oktober 2024 mendatang beliau akan dilantik sebagai Presiden Republik Indonesia periode 2024 - 2029. ● https://t.co/rXBfnXHIbI,dukung prabowo pilpres 2014 pilpres 2019 pilpres 2024 fakta prabowo presiden ri pilih minggu 20 oktober 2024 beliau lantik presiden republik indonesia periode 2024 2029
Ketum PPJNA 98: Waspadai Sabotase untuk Gagalkan Pelantikan Prabowo-Gibran https://t.co/jjWqc4LF7D,tum ppjna 98 waspada sabotase gagal lantik prabowo gibran
Analisis Sukses atau Tidaknya Pelantikan Presiden Prabowo-Gibran https://t.co/5QVJggLzb9,analisis sukses tidak lantik presiden prabowo gibran
Mendekati pelantikan presiden dan wakil presiden pada 20 Oktober 2024 gambaran pengisi kabinet Prabowo Subianto-Gibran mulai agak terang. https://t.co/moYXs4ZHZm,dekat lantik presiden wakil presiden 20 oktober 2024 gambar isi kabinet prabowo subianto gibran terang
'Kasus Fufufafa Awal Keretakan Hubungan Prabowo-Gibran Pasca Pelantikan 20 Oktober 2024' https://t.co/8Z3KvD5xJC,fufufafa kereta hubung prabowo gibran pasca lantik 20 oktober 2024
Alhamdulillah Selamat atas ditetapkan Presiden @prabowo dan Wakil Presiden ke 8 @gibran_tweet yang telah diputuskan hasil Sidang MK pada hari ini tgl 22 April 2024 . Semoga Allah SWT senantiasa melindungi dan memberikan kesehatan kepada para Pemimpin kami hingga Pelantikan https://t.co/Gk2y6GRELb,alhamdulillah selamat tetap presiden wakil presiden 8 putus hasil sidang mk tgl 22 april 2024 moga allah swt senantiasa lindung sehat pimpin lantik
Alhamdulilah Ditolak MK !! Prabowo Gibran sah Presiden RI dan Wakil Presiden Terpilih !! ️ Sementara itu di sebelah pada gak mau maem. Makanlah sikit nanti sakit .. Move on !! Ayo joget cingkece https://t.co/zdyFnFCnSA,alhamdulilah tolak mk prabowo gibran sah presiden ri wakil presiden pilih belah gak maem makan sikit sakit move on ayo joget cingkece
Presiden Joko Widodo akan berkantor di Ibukota Nusantara atau IKN selama 40 hari hingga sehari jelang pelantikan presiden dan wakil presiden terpilih Prabowo Subianto &amp; Gibran Rakabuming Raka di akhir bulan Oktober 2024 mendatang. #jokowi #Ikn #jokowiberkantordiikn https://t.co/wO50ssYNdz,presiden joko widodo kantor ibukota nusantara ikn 40 hari jelang lantik presiden wakil presiden pilih prabowo subianto amp gibran rakabuming raka oktober 2024 jokowi ikn jokowiberkantordiikn
Sidang Pendahuluan di PTUN Tim Hukum PDIP: Pelantikan Prabowo-Gibran Bisa Ditunda https://t.co/gvbfPvFn2U,sidang dahulu ptun tim hukum pdip lantik prabowo gibran tunda
MEREKA HANYA GEROMBOLAN YANG MUDAH DIMANFAATKAN |kurang lebih mereka terdiri atas tiga kelompok. Yang sangat tidak paham yang cuma setengah paham tapi gampang ngamuk dan yang sangat paham tapi juga pintar memanfaatkan. Yang sangat tidak paham dikasih umpan hal remeh. Dikasih https://t.co/DV48yvCTz2,gerombol mudah manfaat kelompok paham paham gampang ngamuk paham pintar manfaat paham kasih umpan remeh kasih
Mahkamah Konstitusi menolak semua gugatan atas hasil Pemilu Presiden 2024 dari kubu 01 Anies-Cak Imin &amp; kubu 03 Ganjar-Mahfud. Keputusan MK final. Tak ada lagi upaya hukum. Artinya Prabowo-Gibran sah jd capres-cawapres terpilih periode 2024-2029 tinggal tunggu pelantikan. https://t.co/Sl2rFOvnPn,mahkamah konstitusi tolak gugat hasil milu presiden 2024 kubu 01 anies cak imin amp kubu 03 ganjar mahfud putus mk final upaya hukum prabowo gibran sah jd capres cawapres pilih periode 2024 2029 tinggal tunggu lantik
Lusa KPU Tetapkan Prabowo-Gibran sebagai Presiden dan Wakil Presiden Terpilih https://t.co/gDU4UmAIR3,lusa kpu tetap prabowo gibran presiden wakil presiden pilih
Peserta pemilihan presiden atau Pilpres 2024 Ganjar Pranowo dan Anies Baswedan diminta menghadiri pelantikan presiden dan wakil presiden terpilih RI Prabowo-Gibran. (ist) #BeritaPolitik https://t.co/LxoGTXKEnk,serta pilih presiden pilpres 2024 ganjar pranowo anies baswedan hadir lantik presiden wakil presiden pilih ri prabowo gibran ist beritapolitik
Kasus Fufufafa Gibran akan Dimasukkan Kotak Oleh Prabowo setelah Pelantikan 20 Oktober 2024 https://t.co/gL5O4zH7R6,fufufafa gibran masuk kotak prabowo lantik 20 oktober 2024
Momen gemas ketika Prabowo dan Gibran yang sudah resmi ditetapkan sebagai Presiden dan Wakil Presiden ini bersalaman dengan Anies dan Cak Imin. tt/yogiramons https://t.co/oOYczbPsmP,momen gemas prabowo gibran resmi tetap presiden wakil presiden salam anies cak imin tt yogiramons
@ARSIPAJA Pelantikan Prabowo-Gibran sebagai Presiden dan Wakil Presiden RI akan berlangsung pada 20 Oktober 2024. Jokowi mengaku akan langsung pulang ke Solo. https://t.co/fOeKScaIgW,lantik prabowo gibran presiden wakil presiden ri 20 oktober 2024 jokowi aku langsung pulang solo
RG: Pengumuman Pilpres hari ini: Prabowo Presiden. Jokowi tersangka!️ https://t.co/zEqiDPl6c7,rg umum pilpres prabowo presiden jokowi sangka
Menjelang pelantikan Capres-Cawapres terpilih Pemilu 2024 Prabowo Subianto-Gibran Rakabuming Raka muncul usulan pembentukan Presidential Club. https://t.co/V7qejx14So,jelang lantik capres cawapres pilih milu 2024 prabowo subianto gibran rakabuming raka muncul usul bentuk presidential club
PDIP kini minta PTUN menyatakan KPU sbg pejabat negara melakukan perbuatan melawan hukum krn menerima pendaftaran Gibran. Dari situ PDIP akn mendorong MPR mempertimbangkan putusan itu utk membatalkan pelantikan Prabowo-Gibran sbg capres/cawapres terpilih. https://t.co/0OKX3NxmYx https://t.co/Trioz3nOj0,pdip ptun kpu sbg jabat negara buat lawan hukum krn terima daftar gibran situ pdip akn dorong mpr timbang putus utk batal lantik prabowo gibran sbg capres cawapres pilih
Cawe2 Presiden Jokowi Pada Pilpres 2024 Terkonfirmasi Dari Pengakuan Prabowo Pada Jusuf Wanandi Yang Terang2an Menyatakan Bahwa Dia Jadi Presiden Karena Dimenangkan Oleh Jokowi. . Prabowo Petugas Jokowi. .. https://t.co/aWyuK6l5HS ... https://t.co/GnNs00Vrcd,cawe2 presiden jokowi pilpres 2024 konfirmasi aku prabowo jusuf wanandi terang2an presiden menang jokowi prabowo tugas jokowi
