full_text,final_cleaned_text
Bertolak dari IKN saya langsung ke Hanoi Vietnam melanjutkan kunjungan kerja untuk bertemu dengan Presiden Vietnam H.E. Tô Lâm. Pertemuan ini dilakukan untuk mempererat kerja sama yang sudah terjalin antara Indonesia dan Vietnam serta membuka peluang kerja sama di sektor bidang https://t.co/2ziJ5YXbqU,tolak ikn langsung hanoi vietnam lanjut kunjung kerja temu presiden vietnam h e t l m temu erat kerja jalin indonesia vietnam buka peluang kerja sektor bidang
Menko Kemaritiman dan Investasi Luhut Binsar Panjaitan memastikan hubungan Presiden @jokowi dengan Presiden terpilih @prabowo Subianto sangat harmonis. Saat ini Jokowi dan Prabowo tidak bisa diadu domba jadi usaha kalian dipastikan sia sia. https://t.co/klqDK3NfOj,menko maritim investasi luhut binsar panjaitan hubung presiden presiden pilih subianto harmonis jokowi prabowo adu domba usaha sia sia
AHY @AgusYudhoyono siap menjadi bagian dari supertim Presiden terpilih Prabowo 5 Tahun kedepan. Lanjutkan Pembangunan Tingkatkan kesejahteraan 🇲🇨. https://t.co/vE4jMS0Fzt,ahy supertim presiden pilih prabowo 5 depan lanjut bangun tingkat sejahtera
Kpd Yth Pak Presiden @prabowo,kpd yth presiden
Menghadiri dan mendengarkan arahan Presiden RI @jokowi dalam Sidang Kabinet Paripurna terakhir. Istana Garuda Ibu Kota Nusantara. https://t.co/lNEDjlhxtb,hadir dengar arah presiden ri sidang kabinet paripurna istana garuda kota nusantara
Ketua Harian Gerindra Sufmi Dasco Ahmad menegaskan tidak ada keretakan hubungan antara presiden terpilih Prabowo Subianto dan wakil presiden terpilih Gibran Rakabuming setelah viralnya akun Kaskus Fufafa. | #Prabowo #Gibran #Fufufafa https://t.co/vok98lnYr1,ketua hari gerindra sufmi dasco ahmad kereta hubung presiden pilih prabowo subianto wakil presiden pilih gibran rakabuming viralnya akun kaskus fufafa prabowo gibran fufufafa
Seekor Singa tidak pernah terusik oleh berisiknya suara sekumpulan bebek Pemimpin besar tidak terpengaruh suara2 sumbang yg mencela menghina mengadu domba bahkan memfitnah Dia fokus pada tujuan menyejahterakan rakyat Itulah sikap Presiden terpilih @prabowo untuk Indonesia https://t.co/ztda7eTIQg,ekor singa usik berisik suara kumpul bebek pimpin pengaruh suara2 sumbang yg cela hina adu domba fitnah fokus tuju sejahtera rakyat sikap presiden pilih indonesia
Kalo ini saya salut sama pak prabowo. Gak tau lah kalo projo. Pro jokowi junto PSI ya? Projo sama pro prabowo itu beda. https://t.co/ETkxLAKiQ5,kalo salut prabowo gak tau kalo projo pro jokowi junto psi ya projo pro prabowo beda
 Kalau Presiden Jokowi Diktator anda tidak akan jadi Gubernur DKI Jakarta Dan sekarang kejadian beneran kan Pak @prabowo Masih mau bilang @jokowi bukan diktator? PERINGATAN DARURAT #KawalPutusanMK https://t.co/9R6PiU0Yp9,presiden jokowi diktator gubernur dki jakarta jadi beneran bilang diktator ingat darurat kawalputusanmk
Soal Akun Fufufafa Dasco Sebut Prabowo Tidak Ambil Pusing dan Tidak Retakkan Hubungan Ketua Umum Partai Gerakan Indonesia Raya (Gerindra) sekaligus Presiden terpilih RI Prabowo Subianto tidak ambil pusing terhadap akun media sosial Kaskus Fufufafa. Hal itu disampaikan oleh https://t.co/bsRDuoecB4,akun fufufafa dasco prabowo ambil pusing retak hubung ketua partai gera indonesia raya gerindra presiden pilih ri prabowo subianto ambil pusing akun media sosial kaskus fufufafa
Loyalitas menjadi variabel yang paling penting bagi presiden terpillih bagi Prabowo Subianto saat menunjuk anggota kabinet. Tidak boleh ada double standart atau double loyalty terkait dengan kerja-kerja di kabinet. #JudolRIP #jagadatakita Adel Lingerie https://t.co/fU3Uh2CEXK,loyalitas variabel presiden terpillih prabowo subianto anggota kabinet double standart double loyalty kait kerja kerja kabinet judolrip jagadatakita adel lingerie
Boleh punya Presiden seakrab ini dengan keluarga kepala negara lain? Presiden terpilih @prabowo mengunjungi PM Thailand yg baru Paetongtarn Shinawatra 37 th putri bungsu mantan PM Thailand Thaksin Shinawatra Bila hubungan antar kepala negara bisa se-sweet ini pasti mampu https://t.co/Ns0mqmoI4m,presiden akrab keluarga kepala negara presiden pilih unjung pm thailand yg paetongtarn shinawatra 37 th putri bungsu mantan pm thailand thaksin shinawatra hubung kepala negara sweet
Prabowo: Saya ingin menghilangkan kemiskinan dari bumi Indonesia dan kita mulai dengan memberi makan untuk anak-anak kita https://t.co/8jgBBUqqvR,prabowo hilang miskin bumi indonesia makan anak anak
Hayo siapa yg sepakat dg statement Presiden terpilih @prabowo Kalo gw sih Iyes Saat ini yg dihormati hanya orang yg punya uang bukan kita hormati akhlak... Bila mindset ini tidak dirubah maka tunggulah kehancurannya Save Indonesia dg ADAB https://t.co/0Ru8TWThs2,hayo yg sepakat dg statement presiden pilih kalo gw sih iyes yg hormat orang yg uang hormat akhlak mindset rubah tunggu hancur save indonesia dg adab
Musibah buat sejarah Republik Indonesia Wakil Presiden nya pak Prabowo dibawah Standar dari wapres wapres Terdahulu yang pernah menjabat Sbg wapres 𝗦𝘂𝗻𝗴𝗴𝘂𝗵 𝗸𝗲𝗰𝗲𝗹𝗮𝗸𝗮𝗮𝗻 𝘀𝗲𝗷𝗮𝗿𝗮𝗵 𝘆𝗴 𝘁𝗮𝗸 𝘁𝗲𝗿𝗲𝗹𝗮𝗸𝗸𝗮𝗻. Mr Mas Beler Fufufafa https://t.co/sH2yJenmMK,musibah sejarah republik indonesia wakil presiden nya prabowo bawah standar wapres wapres jabat sbg wapres       mr mas beler fufufafa
Elang tak membalas patokan gagak saat terbang Padahal kalau mau elang bisa merobek tubuh gagak tapi apalah guna Elang terus terbang tinggi menembus langit gagak tak mampu bernafas. Oleng. Terlempar Presiden terpilih @prabowo fokus tujuan menyelamatkan uang rakyat https://t.co/zGedU29Vkr,elang balas patok gagak terbang elang robek tubuh gagak apa elang terbang tembus langit gagak nafas oleng lempar presiden pilih fokus tuju selamat uang rakyat
Ketua Harian Partai Gerindra Sufmi Dasco Ahmad menyebut Presiden terpilih Prabowo Subianto tak ambil pusing dengan polemik akun media sosial Kaskus Fufufafa. | #Gerindra #Prabowo #Fufufafa https://t.co/OZ7OzbBKnA,ketua hari partai gerindra sufmi dasco ahmad sebut presiden pilih prabowo subianto ambil pusing polemik akun media sosial kaskus fufufafa gerindra prabowo fufufafa
. Gara-gara Fufufafa. Fafa jadi harus Fafifu. -- Jokowi Hatinya jadi Khawatir soal Hubungannya Dengan Prabowo kedepan. 'Masih Mau enggak ya Prabowo menjadi Petugasnya ? (Sebagai Presiden yg dia Pilih) 'Masih mau enggak ya Prabowo jadi PENGASUH &amp; menjaga Anaknya ? https://t.co/3km2XtQQIP,gara gara fufufafa fafa fafifu jokowi hati khawatir hubung prabowo depan ya prabowo tugas presiden yg pilih ya prabowo asuh amp jaga anak
Ada 3 kunjungan Paus ke Indonesia. Pertama saat jelang jatuhnya Soekarno presiden pertama RI lalu kedua adalah saat jelang lengsernya Soeharto presiden kedua RI dan ketiga tempo hari jelang pergantian presiden dari Jokowi ke Prabowo.,3 kunjung paus indonesia jelang jatuh soekarno presiden ri jelang lengser soeharto presiden ri tiga tempo jelang ganti presiden jokowi prabowo
Momen Menteri Pertahanan Prabowo Subianto @prabowo melakukan pertemuan dengan Presiden Vietnam H.E. Tô Lâm di Vietnam Jumat (13/9). https://t.co/3nVGfVuKBN,momen menteri tahan prabowo subianto temu presiden vietnam h e t l m vietnam jumat 13 9
Memang gak perlu pusing. Namanya juga sudah dibantu jadi Presiden. Tenang Pak Prabowo saya sudah disini . Apa artinya ini?,gak pusing nama bantu presiden tenang prabowo
Padahal udah jelas presiden nya nanti parbowo tapi buzzer nya kalau gak senggol abah Anies sepi ya kontenya dikit ya viwers nya kasihan yaa Kan udah jelas presidennya prabowo kasihan ya ga di anggap kalau kita mah anak abah di anggap dicintai sama abah kalian engga kasihan https://t.co/XKKjfXzyrf,udah presiden nya parbowo buzzer nya gak senggol abah anies sepi ya konte dikit ya viwers nya kasihan yaa udah presiden prabowo kasihan ya ga anggap mah anak abah anggap cinta abah engga kasihan
2. Pertemuan ini bertujuan untuk memperkuat kerjasama bilateral di sektor pertanian &amp; peternakan antar kedua negara. Selain itu Wamentan juga menjelaskan ihwal program makan bergizi gratis yang menjadi salah satu prioritas pemerintahan Presiden Terpilih Prabowo Subianto.,2 temu tuju kuat kerjasama bilateral sektor tani amp terna negara wamentan ihwal program makan gizi gratis salah prioritas perintah presiden pilih prabowo subianto
Ketum @AgusYudhoyono (AHY) menyerahkan sepenuhnya kepada presiden terpilih Prabowo Subianto terkait susunan pemerintahan termasuk potensi mengajak rival politik. AHY sangat yakin Prabowo sangat memahami pembangunan dan stabilitas politik. https://t.co/0zITCrDoPs https://t.co/tK5elYihKo,tum ahy serah sepenuh presiden pilih prabowo subianto kait susun perintah potensi ajak rival politik ahy prabowo paham bangun stabilitas politik
Saya bingung sm Logika orang2 Kita.. Prabowo itu sudah resmi Presiden.. Tinggal Pengesahan saja.. Sudah di puncak Tertinggi.. Usia jg lanjut.. Untuk apa lagi main2 sama Konstitusi demi beberapa Kab Kota Prov..? Jika rakyat marah chaos yg rugi siapa..? Yg untung siapa..?,bingung sm logika orang2 prabowo resmi presiden tinggal kesah puncak tinggi usia jg main2 konstitusi kab kota prov rakyat marah chaos yg rugi yg untung
Saking susahnya Pribumi mencari pekerjaan ini lah kesalahan presiden jokowi dalam mengelola negara. Nah piye iki @prabowo https://t.co/OdlFcslKXG,saking susah pribumi cari kerja salah presiden jokowi kelola negara piye iki
Saya bersama Panglima TNI mendampingi Bapak Presiden RI menyambut kedatangan Paus Fransiskus di Stadion Madya Gelora Bung Karno sebelum pelaksanaan misa akbar. Misa akbar di GBK Senayan adalah agenda terakhir dalam rangkaian kunjungan Paus Fransiskus di Indonesia. Tentunya https://t.co/ccCMksSdha,panglima tni damping presiden ri sambut datang paus fransiskus stadion madya gelora karno laksana misa akbar misa akbar gbk senayan agenda rangkai kunjung paus fransiskus indonesia
Tak banyak yang tahu bahwa presiden terpilih 2024-2029 Prabowo Subianto berperan dalam pendirian SMA Taruna Nusantara yang merupakan SMA unggulan Tanah Air saat ini. Dirgayuza Setiawan putra dari almarhum Dr. dr. Boyke Setiawan yang semasa hidupnya merupakan orang kepercayaan https://t.co/jGk9MjtMh9,presiden pilih 2024 2029 prabowo subianto peran diri sma taruna nusantara sma unggul tanah air dirgayuza setiawan putra almarhum dr dr boyke setiawan hidup orang percaya
Prabowo emangnya mau diatur-atur Mulyono setelah dilantik jadi Presiden?! Rendah amat @prabowo kalau jadi petugas Mulyono https://t.co/JxmPExvKIz,prabowo emang atur atur mulyono lantik presiden rendah tugas mulyono
Ga kebayang di sekolah²/kampus/kantor... bakal kepanjang foto wapres yg jejak digital nya menyeramkan : Mesum cabul kasar suka melecehkan org lain dan menghina secara biadab presiden nya yg foto nya ada disebelah nya ‍️ Pendidikan yg ga baik buat anak SD tuh kek @prabowo,ga bayang sekolah kampus kantor panjang foto wapres yg jejak digital nya seram mesum cabul kasar suka leceh org hina biadab presiden nya yg foto nya belah nya didik yg ga anak sd tuh kek
Ragu akan Badan Otorita Penerimaan Negara Revisi Undang-Undang Kementerian Negara bakal membuka peluang bagi presiden terpilih Prabowo Subianto membentuk Badan Otorita Penerimaan Negara. #korantempodigital #KoranTempo https://t.co/3HBEa2WYVm,ragu badan otorita terima negara revisi undang undang menteri negara buka peluang presiden pilih prabowo subianto bentuk badan otorita terima negara korantempodigital korantempo
Perasaan baru aja sy ketiduran sak sliyutan (sekejap) Presiden terpilih @prabowo sudah bertemu dan disambut hangat oleh Raja Malaysia Yang Dipertuan Agung Sultan Ibrahim Ibni Sultan Iskandar Kalian yg ngawal bapak hati2 yah ketiduran sebentar aja bapak sudah pindah negara https://t.co/YSUXxAhOs0,asa aja sy tidur sak sliyutan kejap presiden pilih temu sambut hangat raja malaysia tuan agung sultan ibrahim ibni sultan iskandar yg ngawal hati2 yah tidur sebentar aja pindah negara
@prabowo @Ki_Nusantara99 Istirahat yang cukup pak Presiden berkeliling Asia pasti melelahkan. https://t.co/msNNE3UdFB,istirahat presiden keliling asia lelah
Narasi bahwa ramai Fufufafa untuk adu domba prabowo dan Jokowi sangat diluar nalar karena bersatunya mereka sebagai Presiden dan Menteri selama 5thn tidak ada Prestasi yang bermanfaat untuk Rakyat malah yang ada kegagalan Food Estate,narasi ramai fufufafa adu domba prabowo jokowi luar nalar satu presiden menteri 5thn prestasi manfaat rakyat gagal food estate
Prabowo Balas Salam Hormat Megawati Sekjen Partai Gerindra Ahmad Muzani mengatakan Ketum PDIP Megawati Soekarnoputri menyampaikan salam kepada Presiden terpilih @prabowo. Muzani menyebut Prabowo pun menitipkan salam kepada Megawati. Salam itu disampaikan Muzani saat https://t.co/WIuIKOTeCv,prabowo balas salam hormat megawati sekjen partai gerindra ahmad muzani tum pdip megawati soekarnoputri salam presiden pilih muzani sebut prabowo titip salam megawati salam muzani
ISU FUFUFAFA PRABOWO DINILAI TAK GAMPANG DIHASUT Presiden terpilih Prabowo dinilai tak gampang dihasut oleh isu yang berseliweran. Terkait akun Kaskus Fufufafa. #JudolTerkutuk Cherry Lai Indodax Towel Belanda PSSI Gadis Kretek Malam Jumat https://t.co/Hv1mVVspPk,isu fufufafa prabowo nilai gampang hasut presiden pilih prabowo nilai gampang hasut isu seliwer kait akun kaskus fufufafa judolterkutuk cherry lai indodax towel belanda pssi gadis kretek malam jumat
Terbongkarnya kasus fufufafa semakin meyakinkan @aniesbaswedan adalah anggota elite global @BudiBukanIntel dll adalah kroni2nya untuk menjegal presiden komrad prabski @prabowo. Terbukti fufufafa anak abah sejak lama. Aku siap.... #IndonesiaEmas2045 #Jokowihebat #tapiboong https://t.co/dQhepo1f18,bongkar fufufafa anggota elite global dll kroni2nya jegal presiden komrad prabski bukti fufufafa anak abah indonesiaemas2045 jokowihebat tapiboong
Jk Presiden @prabowo mau perangi korupsi cara pembuktian spy rakyat yakin &amp; percaya adlah tdk mengangkat Ketum Parpol or elit parpol yg pernah ditengarai dlm pusaran korupsi menjd Menteri. Ga perlu bilang mengejar koruptor sampe Antartika sekalipun yg dekat ajalah dulu! ,jk presiden rang korupsi bukti spy rakyat amp percaya adlah tdk angkat tum parpol or elit parpol yg tengara dlm pusar korupsi menjd menteri ga bilang kejar koruptor sampe antartika yg aja
Celetukan Fufufafa Ledek Prabowo Subianto: Presiden Jadi-jadian https://t.co/M3KnyME4RC,celetuk fufufafa ledek prabowo subianto presiden jadi
Menteri Pertahanan RI sekaligus Presiden terpilih Prabowo Subianto membuat terharu Presiden Joko Widodo (Jokowi) saat Sidang Paripurna terakhir yang dihelat di Istana Garuda Ibu Kota Nusantara Kalimantan Timur Jumat (13/9). Momen itu diungkap oleh Menteri Koordinator Bidang https://t.co/C5USvnerot,menteri tahan ri presiden pilih prabowo subianto haru presiden joko widodo jokowi sidang paripurna helat istana garuda kota nusantara kalimantan timur jumat 13 9 momen ungkap menteri koordinator bidang
Nemu opini bagus tentang arah polugri Indonesia dibawah Presiden terpilih Prabowo di ASEAN dan Indo-Pasifik https://t.co/9HpV9uz8Ki https://t.co/ggarFJASyb,nemu opini bagus arah polugri indonesia bawah presiden pilih prabowo asean indo pasifik
Dalam kunjungan resmi ini Menhan Prabowo diagendakan akan bertemu dengan sejumlah pimpinan tinggi Vietnam yaitu Presiden Vietnam H.E. Tô Lâm Ketua Majelis Nasional Vietnam H.E. Tran Thanh Man dan Perdana Menteri Vietnam H.E. Pham Minh Chinh. https://t.co/FZdEwlLV6K,kunjung resmi menhan prabowo agenda temu pimpin vietnam presiden vietnam h e t l m ketua majelis nasional vietnam h e tran thanh man perdana menteri vietnam h e pham minh chinh
 Partai Demokrat sendiri tentunya ingin menjadi bagian dari proses transisi kepemimpinan nasional pemerintahan hari ini yang di bawah pimpinan Presiden Joko Widodo dan 5 tahun ke depan di bawah Presiden Bapak Prabowo Subianto. Insya Allah Demokrat akan semakin berperan ke depan https://t.co/ALAv0etWmq,partai demokrat proses transisi pimpin nasional perintah pimpin presiden joko widodo 5 presiden prabowo subianto insya allah demokrat peran
Dia tumbuh sebagai petarung bukan pecundang Jauh lisan dari umpatan apalagi hasutan Jatuh bangun Presiden terpilih @prabowo adalah inspirasi Hidup harus dimenangkan Hidup tidak untuk diratapi Hidup bukan untuk melampiaskan hawa nafsu Menjadikan hidup sebagai ladang pahala https://t.co/3gy3K4vcoN,tumbuh tarung cundang lisan umpat hasut jatuh bangun presiden pilih inspirasi hidup menang hidup ratap hidup lampias hawa nafsu jadi hidup ladang pahala
Anjing anjing buduk sedang giat-giatnya membuat tagar memgkriminalisasi presiden dan memecah belah prabowo gibran.. Sayang sekali onani kalian itu kejauhan mengkhayalnya.,anjing anjing buduk giat giat tagar memgkriminalisasi presiden pecah belah prabowo gibran sayang onani jauh khayal
Tuhan jadikanlah pak @prabowo pemimpin yg mencintai rakyat melebihi ia mencintai dirinya sendiri Yg berdiri paling depan saat rakyatnya diperlakukan tidak adil Yg tetap terjaga di saat rakyatnya tidur Yg membuat wong cilik tersenyum Tuhan tolong jaga serta lindungilah dia https://t.co/2mvR67iohD,tuhan jadi pimpin yg cinta rakyat lebih cinta yg diri rakyat laku adil yg jaga rakyat tidur yg cilik senyum tuhan tolong jaga lindung
PKB Tak Diajak Bahas Kabinet Prabowo Gerindra: Itu Hak Prerogatif Presiden. Jwbn Gerindra sdh betul ngapain mesti ngajak PKB emang wajib. Klen PKB n Cak Imin ga dianggap klen jual diri dgn hrg murahan sik. Rasain! ,pkb ajak bahas kabinet prabowo gerindra hak prerogatif presiden jwbn gerindra sdh ngapain mesti ngajak pkb emang wajib klen pkb n cak imin ga anggap klen jual dgn hrg murah sik rasain
Viral akunnya fufufafa yg di sangkakan milik wapres Terpilih 2024 yg cuitannya dr pembullyan thdp Presiden Terpilih 2024 @prabowo hingga cuitan MESUM yg menjijikan telah di up Media Negara Lain. Membantah yg sdh tersebar emang sulit walaupun ada tukang ceboknya!! Malunya https://t.co/nmP4Cy8gMK,viral akun fufufafa yg sangka milik wapres pilih 2024 yg cuit dr pembullyan thdp presiden pilih 2024 cuit mesum yg jijik up media negara ban yg sdh sebar emang sulit tukang cebok malu
Jumlah Menteri di Kabinet Prabowo Diperkirakan Bertambah Pengamat: Hak Prerogatif Presiden Tapi Perlu Kewajiban Mempertimbangkan Rekam Jejak https://t.co/h7ThLTLZqO,menteri kabinet prabowo tambah amat hak prerogatif presiden wajib timbang rekam jejak
Menteri Pertahanan Prabowo Subianto @prabowo menghadiri pengarahan Presiden RI kepada pejabat TNI dan Polri di Istana Garuda Ibu Kota Nusantara Kalimantan Timur Kamis (12/9) sekitar pukul 14.00 WITA. https://t.co/lCLXcsRDrE,menteri tahan prabowo subianto hadir arah presiden ri jabat tni polri istana garuda kota nusantara kalimantan timur kamis 12 9 14 00 wita
Akun Kaskus Fufufafa menjadi perbincangan warganet karena sering melontarkan hinaan-hinaan kepada presiden terpilih Prabowo Subianto. Namun Dasco secara tegas menyatakan bahwa viralnya akun Fufufafa tersebut ini tidak membuat keretakan antara Prabowo dan Gibran. #JauhiJudol https://t.co/LjPoZ1z2pP,akun kaskus fufufafa bincang warganet lontar hina hina presiden pilih prabowo subianto dasco viralnya akun fufufafa kereta prabowo gibran jauhijudol
Melanjutkan kunjungan kerja bertemu dengan Presiden Republik Demokratik Rakyat Laos Yang Mulia Thongloun Sisoulith. Selanjutnya saya juga bertemu dengan Perdana Menteri Laos Sonexay Siphandone. Pertemuan bilateral ini kami lakukan guna perkuat kerja sama yang menguntungkan dua https://t.co/6tviOxBRr8,lanjut kunjung kerja temu presiden republik demokratik rakyat laos mulia thongloun sisoulith temu perdana menteri laos sonexay siphandone temu bilateral laku kuat kerja untung
Bagaiman dengan orang-orang Sekeliling lu??? Prabowo: Pemerintahan Saya Pimpin Nanti Tak Kompromi dengan Korupsi Presiden terpilih Prabowo Subianto menyatakan tak bakal berkompromi dengan praktik korupsi di Indonesia. Prabowo mengaku tidak gentar untuk memberantas https://t.co/qQsFpREJMP,bagaiman orang orang keliling lu prabowo perintah pimpin kompromi korupsi presiden pilih prabowo subianto kompromi praktik korupsi indonesia prabowo aku gentar berantas
Bukan main nyali Presiden terpilih Prabowo meminta Bro Putin bisa ikutkan TNI-AL Indonesia berpartisipasi di hari angkatan laut Rusia https://t.co/P3Awc1MexD,main nyali presiden pilih prabowo bro putin ikut tni al indonesia partisipasi angkat laut rusia
Transisi pemerintahan Presiden @jokowi ke Presiden terpilih @prabowo berjalan mulus APBN 2025 difokuskan untuk menyukseskan program Presiden terpilih @prabowo Ibu pinter ini mendiskusikan RAPBN dg rileks namun fokus Terima kasih atas kerja kerasnya Bu Sri Akankah ibu https://t.co/VpctzFnbTE,transisi perintah presiden presiden pilih jalan mulus apbn 2025 fokus sukses program presiden pilih pinter diskusi rapbn dg rileks fokus terima kasih kerja keras bu sri
SATU YG GUE HARAP DARI PEMERINTAHAN @prabowo @gibran_tweet TEGAKAN HUKUM PD PELAKU KEBENCIAN FITNAH OPINI SESAT HOAX DI SOSIAL MEDIA ATAU UMUM YG MENGHINA PRESIDEN DAN WAKIL PRESIDEN‼️ BANGUNKAN @CCICPolri dan @DivHumas_Polri KARENA HAL SPT ITU SERING MMBUAT KEGADUHAN ‼️,yg gue harap perintah tega hukum pd laku benci fitnah opini sesat hoax sosial media yg hina presiden wakil presiden bangun spt mmbuat gaduh
Habib Rizieq Peringatkan Prabowo Ada Beban Besar Setelah Pelantikan Presiden Beri Pesan Ini Agar Bisa Selamatkan NKRI https://t.co/0sFwSGkWIf,habib rizieq ingat prabowo beban lantik presiden pesan selamat nkri
Emak titip kepada ncu @prabowo kelak kalau sudah jadi presiden hendaknya pilih KAPOLRI &amp; PANGLIMA TNI serta MENTERI MENTERI yg punya perhatian besar kepada perbaikan AKHLAQ BANGSA bukan yg mementingkan POLITIK KEKUASAAN &amp; KEKAYAAN semata. CAMKAN ITU ! #5thEmakBakalMonitorKamu️,emak titip ncu kelak presiden pilih kapolri amp panglima tni menteri menteri yg perhati baik akhlaq bangsa yg penting politik kuasa amp kaya cam 5themakbakalmonitorkamu
MOMENT2 PENTING &amp; BERSEJARAH PRABOWO SUBIANTO yg telah mengajarkan pada kita ttg kegigihan &amp; ketulusan utk mengabdi pada NKRI 1. Penyerahan surat penetapan KPU RI 2. Ucapan terima kasih thd Presiden Jokowi 3. Doa syukur usai pengumuman 4. Pidato perdana usai penetapan kemenangan https://t.co/gB7Jbrb32k,moment2 amp sejarah prabowo subianto yg ajar ttg gigih amp tulus utk abdi nkri 1 serah surat tetap kpu ri 2 ucap terima kasih thd presiden jokowi 3 doa syukur umum 4 pidato perdana tetap menang
Percayalah tdk akan terjd 2 matahari pd pemerintahan Prabowo-Gibran. Prabowo tdk akan sudi berikan peran ke Jokowi apalg Gibran saat dia berkuasa. Prabowo terlht sopan saat ini krn Jokowi msh presiden definitif! ,percaya tdk terjd 2 matahari pd perintah prabowo gibran prabowo tdk sudi peran jokowi apalg gibran kuasa prabowo terlht sopan krn jokowi msh presiden definitif
Keren juga si gibran musuhnya nggak kaleng kaleng dari buruh sampai mantan presiden bahkan pak @prabowo presiden yang sebentar lagi akan dilantik ,keren si gibran musuh nggak kaleng kaleng buruh mantan presiden presiden sebentar lantik
 @prabowo Subianto beserta jajarannya ingin menyelamatkan kekayaan bangsa Indonesia tidak ada yg lebih dari itu Kader2 Gerindra jika kalian jadi pemimpin jangan Kalian jadi koruptor! Karena Presiden terpilih sendiri yg akan mengejar kalian! Awasi level pelayanan publik https://t.co/0lFETrJHgj,subianto serta jajar selamat kaya bangsa indonesia yg kader2 gerindra pimpin koruptor presiden pilih yg kejar awas level layan publik
INGA...INGA... Rumusnya Sebaliknya Ketua Harian Partai Gerindra Sufmi Dasco Ahmad menyebut Presiden terpilih Prabowo Subianto tak ambil pusing dengan polemik akun media sosial Kaskus Fufufafa. https://t.co/4IuEVmMmLW,inga inga rumus ketua hari partai gerindra sufmi dasco ahmad sebut presiden pilih prabowo subianto ambil pusing polemik akun media sosial kaskus fufufafa
Raja tanpa ratu tetaplah Raja Dahulu tidak sedikit yg menghina karena Presiden terpilih @prabowo tidak memiliki pasangan Kami butuh pemimpin yg mampu memajukan negara bukan yg memamerkan kemesraan Kami butuh pemimpin tegas yg mampu membawa kejayaan Indonesia yg selama ini https://t.co/DnY9kzTyfd,raja ratu tetap raja yg hina presiden pilih milik pasang butuh pimpin yg maju negara yg pamer mesra butuh pimpin yg bawa jaya indonesia yg
Kabar Menteri Mencuat‼️ Yth Bpk Presiden Terpilih Bpk @prabowo Jika Mencari Calon Menteri Carilah Menteri Yg Sesuai Dgn Bidangnya. Contoh Menkominfo Carilah yg Memang Betul² Ahli Di Bidang Tekhnologi Jangan Tukang Cebok Di Jadikan Menteri Rusak Pak https://t.co/bX1eASm2Md,kabar menteri cuat yth bpk presiden pilih bpk cari calon menteri cari menteri yg sesuai dgn bidang contoh menkominfo cari yg betul ahli bidang tekhnologi tukang cebok jadi menteri rusak
 Saya mau pulang ke Solo. Pada tanggal 20 Oktober nanti pulang ke Solo kata Presiden Jokowi. | #Wantimpres #Prabowo #Jokowi https://t.co/OZXgBjQX2w,pulang solo tanggal 20 oktober pulang solo presiden jokowi wantimpres prabowo jokowi
Nih yang dari kemarin penasaran mau baca buku-bukunya Pak Prabowo. Baca aja di sini bisa diunduh juga PDF-nya. https://t.co/vw5nUIHDsM https://t.co/INw0lxt7YX,nih kemarin penasaran baca buku buku prabowo baca aja unduh pdf nya
Zanken kabinet Presiden terpilih @prabowo adalah kabinet para ahli Sebab bila sesuatu tidak diserahkan kpd ahlinya maka tunggulah kehancurannya Wacana ini diapresiasi semua pihak terutama rakyat Doa terbaik untuk pemimpin karena kebaikan pemimpin akan kembali kpd rakyat https://t.co/5PIWFhX7LZ,zanken kabinet presiden pilih kabinet ahli serah kpd ahli tunggu hancur wacana apresiasi rakyat doa baik pimpin baik pimpin kpd rakyat
Pakar HTN Ungkap Jokowi Masih Bisa Bikin Prabowo 'Batal' Jadi Presiden Bagaimana Caranya? https://t.co/gfraIqVSmQ,pakar htn jokowi bikin prabowo batal presiden
VIDEO: Momen Pertemuan Prabowo dan Presiden Vietnam To Lam https://t.co/oTKlmnMaaF,video momen temu prabowo presiden vietnam to lam
