full_text,final_cleaned_text
Ibukota Nusantara Akan Dilanjutkan Dimasa Pemerintahan Presiden Terpilih RI Prabowo Subianto. #IbuKotaNegaraNusantara #IKN #IKNNusantara #IndonesiaEmas2045 #SmartCity #KotaModern #IndonesiaMaju #SmartDefenseSystem https://t.co/dILAxoPXqy,ibukota nusantara lanjut masa perintah presiden pilih ri prabowo subianto ibukotanegaranusantara ikn iknnusantara indonesiaemas2045 smartcity kotamodern indonesiamaju smartdefensesystem
Rakyat baik berdoa kebaikan untuk pemimpin juga negaranya Penguatan devisa membuktikan Indonesia Baik-Baik Saja Pakar seluruh dunia mengatakan aset terhebat Indonesia menuju negara terkaya ke 4-5 adalah RUKUN Ingat pesan Presiden terpilih @prabowo RUKUN RUKUN RUKUN 🇮🇩 https://t.co/VtWPW7oFVk,rakyat doa baik pimpin negara kuat devisa bukti indonesia pakar dunia aset hebat indonesia negara kaya 4 5 rukun pesan presiden pilih rukun rukun rukun
Presiden Jokowi didampingi Menhan sekaligus presiden terpilih Prabowo Subianto Menlu Retno Marsudi beberapa menteri lain menerima Paus Fransiskus yang didampingi kardinal dan sejumlah uskup selama upacara penyambutan di Istana Merdeka Jakarta https://t.co/0h3FQ0MAcw,presiden jokowi damping menhan presiden pilih prabowo subianto menlu retno marsudi menteri terima paus fransiskus damping kardinal uskup upacara sambut istana merdeka jakarta
Keberlanjutan perekonomian dimasa presiden Jokowi akan dilanjutkan oleh presiden terpilih Prabowo https://t.co/04dkkMxLGv,lanjut ekonomi masa presiden jokowi lanjut presiden pilih prabowo
Buat penghujat pemerintah khususnya ke presiden puas2in deh skrg. Siapa tahu stl 20 oktober sdh ga bisa. Krn mgkn pak prabowo bersedia meluangkan waktu utk mendidik rakyatnya yg sdh berlebihan dalam menghujat itu.,hujat perintah presiden puas2in deh skrg stl 20 oktober sdh ga krn mgkn prabowo sedia luang utk didik rakyat yg sdh hujat
Berkenan menerima pesambah KDYMM Paduka Seri Baginda Sultan Haji Hassanal Bolkiah Mu izzaddin Waddaulah berkenan menerima pesambah daripada Menteri Pertahanan dan bakal Presiden Republik Indonesia TYT Jenderal TNI (Purn.) Prabowo Subianto semasa majlis mengadap yang berlangsung https://t.co/4lR9cXjZTM,kenan terima pesambah kdymm paduka seri baginda sultan haji hassanal bolkiah mu izzaddin waddaulah kenan terima pesambah menteri tahan presiden republik indonesia tyt jenderal tni purn prabowo subianto majlis adap
Presiden Terpilih Prabowo Subianto Akan Melanjutkan Program Presiden Joko Widodo. #IbuKotaNegaraNusantara #IKN #IKNNusantara #IndonesiaEmas2045 #SmartCity #KotaModern #IndonesiaMaju #SmartDefenseSystem https://t.co/kAh6kPoVQI,presiden pilih prabowo subianto lanjut program presiden joko widodo ibukotanegaranusantara ikn iknnusantara indonesiaemas2045 smartcity kotamodern indonesiamaju smartdefensesystem
Presiden Terpilih Prabowo Subianto berkomitmen untuk melanjutkan program-program strategis yang telah dicanangkan oleh Joko Widodo termasuk hilirisasi industri dan pembangunan Ibu Kota Negara (IKN). #IbuKotaNegaraNusantara #IKN #IKNNusantara #IndonesiaEmas2045 #SmartCity https://t.co/SA4epjXbBI,presiden pilih prabowo subianto komitmen lanjut program program strategis canang joko widodo hilir industri bangun kota negara ikn ibukotanegaranusantara ikn iknnusantara indonesiaemas2045 smartcity
ADEM... Kami merindukan persaudaraan seperti ini Hari ini kita belajar satu hal yaitu KASIH SAYANG dari Paus Fransiskus dan Imam Besar Masjid Istiqlal Peristiwa indah di masa akhir Presiden @jokowi Kepada Presiden terpilih @prabowo saat bapak memimpin nanti jadikanlah bumi https://t.co/Whv1m8GV6Z,adem rindu saudara ajar kasih sayang paus fransiskus imam masjid istiqlal peristiwa indah presiden presiden pilih pimpin jadi bumi
Presiden Terpilih Prabowo Subianto berkomitmen untuk melanjutkan program strategis yang telah dicanangkan oleh Joko Widodo termasuk hilirisasi industri dan pembangunan Ibu Kota Negara (IKN). #IbuKotaNegaraNusantara #IKN #IKNNusantara #IndonesiaEmas2045 #SmartCity #KotaModern https://t.co/Iwd1ge6wxq,presiden pilih prabowo subianto komitmen lanjut program strategis canang joko widodo hilir industri bangun kota negara ikn ibukotanegaranusantara ikn iknnusantara indonesiaemas2045 smartcity kotamodern
Untuk urusan ambisi untuk jadi presiden Prabowo selalu mengajak supaya orang ingat pada ramalan Gusdur tapi di saat yg sama dia tidak menunjukan diri sebagai orang yg pernah dikatakan Gus Dur sbg orang yg ikhlas,urus ambisi presiden prabowo ajak orang ramal gusdur yg tunjuk orang yg gus dur sbg orang yg ikhlas
Di tengah isu keretakan mereka presiden Jokowi dan presiden terpilih Prabowo Subianto saling melempar pujian di berbagai kesempatan. Apakah hubungan harmonis ini tetap terjalin usai Jokowi lengser? #MetroTVKontroversi Seni Memahami Jokowi-Prabowo Kamis (5/9) pukul 21.05 WIB https://t.co/ZvNRmbFNF1,isu kereta presiden jokowi presiden pilih prabowo subianto lempar puji sempat hubung harmonis jalin jokowi lengser metrotvkontroversi seni paham jokowi prabowo kamis 5 9 21 05 wib
Presiden Terpilih Prabowo Subianto berkomitmen untuk melanjutkan program-program strategis yang telah dicanangkan oleh Joko Widodo termasuk hilirisasi industri dan pembangunan IKN https://t.co/B3m4z0TE5J,presiden pilih prabowo subianto komitmen lanjut program program strategis canang joko widodo hilir industri bangun ikn
Kalo gak milih Prabowo trus gak boleh gitu berharap sama doi? Knp gak sekalian gua dibebasin gak usah bayar pajak yg buat gaji dia nanti sbg presiden? Pajak gua sbb: PBB PPN rokok bonus dan gaji pajak mobil dll. Elu tuh kalo bego jgn diborong sekeluarga atuh....!! ,kalo gak milih prabowo trus gak gitu harap doi knp gak gua dibebasin gak bayar pajak yg gaji sbg presiden pajak gua sbb pbb ppn rokok bonus gaji pajak mobil dll elu tuh kalo bego jgn borong keluarga atuh
Presiden Terpilih Prabowo Subianto berkomitmen untuk melanjutkan program-program strategis yang telah dicanangkan oleh Joko Widodo #IbuKotaNegaraNusantara #IKN #IKNNusantara #IndonesiaEmas2045 #SmartCity #KotaModern #IndonesiaMaju #SmartDefenseSystem https://t.co/PomNsT8ell,presiden pilih prabowo subianto komitmen lanjut program program strategis canang joko widodo ibukotanegaranusantara ikn iknnusantara indonesiaemas2045 smartcity kotamodern indonesiamaju smartdefensesystem
Di antara para pejabat yang menyambut Paus Fransiskus Menteri Pertahanan Prabowo Subianto termasuk yang mendapatkan keistimewaan. Paus menyampaikan ucapan selamat secara langsung kepada Prabowo yang terpilih sebagai Presiden RI periode 2024-2029. https://t.co/hfIpUzkRxl https://t.co/I2WuiBiGOj,jabat sambut paus fransiskus menteri tahan prabowo subianto istimewa paus ucap selamat langsung prabowo pilih presiden ri periode 2024 2029
Presiden Terpilih Prabowo Subianto berkomitmen untuk melanjutkan program-program strategis yang telah dicanangkan oleh Joko Widodo termasuk hilirisasi industri dan pembangunan Ibu Kota Negara (IKN). #IbuKotaNegaraNusantara #IKN #IKNNusantara #IndonesiaEmas2045 #SmartCity https://t.co/0kb46m4Urs,presiden pilih prabowo subianto komitmen lanjut program program strategis canang joko widodo hilir industri bangun kota negara ikn ibukotanegaranusantara ikn iknnusantara indonesiaemas2045 smartcity
PHK makin besar kementrian perencanaan nonstop highlevel forum events; mana manfaat langsung untuk rakyat? Yang ada uang pajak rakyat habis untuk bayar hotel &amp; perjadin pejabat. Presiden @prabowo tolonglah buat pejabat negara makin sadar diri &amp; bubarkan saja kementrian begini. https://t.co/HnJZ5qJLI4,phk tri rencana nonstop highlevel forum events manfaat langsung rakyat uang pajak rakyat habis bayar hotel amp perjadin jabat presiden tolong jabat negara sadar amp bubar tri
Pelecehan berat terhadap Presiden terpilih @prabowo . Tolong di proses Pak biar rakyat tidak main hakim sendiri. https://t.co/M4Mnyl8cVy,leceh berat presiden pilih tolong proses biar rakyat main hakim
Presiden Terpilih Prabowo Subianto berkomitmen untuk melanjutkan program-program strategis yang telah dicanangkan oleh Joko Widodo termasuk hilirisasi industri dan pembangunan Ibu Kota Negara (IKN). #IKNNusantara #IndonesiaEmas2045 #SmartCity #KotaModern #IndonesiaMaju https://t.co/qWV9I3AOBl,presiden pilih prabowo subianto komitmen lanjut program program strategis canang joko widodo hilir industri bangun kota negara ikn iknnusantara indonesiaemas2045 smartcity kotamodern indonesiamaju
Ini pergantian presiden prabowo - gibran jadi gak sih. Kok malah udh kacau begini berita2nya pdhl blm jadi,ganti presiden prabowo gibran gak sih udh kacau berita2nya pdhl blm
Presiden Terpilih Prabowo Subianto berkomitmen untuk melanjutkan program-program strategis yang telah dicanangkan oleh Joko Widodo. #IbuKotaNegaraNusantara #IKN #IKNNusantara #IndonesiaEmas2045 #SmartCity #KotaModern #IndonesiaMaju #SmartDefenseSystem https://t.co/5l5Qu9EiV4,presiden pilih prabowo subianto komitmen lanjut program program strategis canang joko widodo ibukotanegaranusantara ikn iknnusantara indonesiaemas2045 smartcity kotamodern indonesiamaju smartdefensesystem
Presiden Terpilih Prabowo berkomitmen untuk melanjutkan program strategis yang telah dicanangkan oleh Jokowi termasuk hilirisasi industri dan pembangunan IKN #IbuKotaNegaraNusantara #IKN #IKNNusantara #IndonesiaEmas2045 #SmartCity #KotaModern #IndonesiaMaju #SmartDefenseSystem https://t.co/xiPKkpoOLB,presiden pilih prabowo komitmen lanjut program strategis canang jokowi hilir industri bangun ikn ibukotanegaranusantara ikn iknnusantara indonesiaemas2045 smartcity kotamodern indonesiamaju smartdefensesystem
Presiden Terpilih Prabowo Subianto berkomitmen untuk melanjutkan program-program strategis yang telah dicanangkan oleh Joko Widodo #IbuKotaNegaraNusantara #IKN #IKNNusantara #IndonesiaEmas2045 #SmartCity #KotaModern #IndonesiaMaju #SmartDefenseSystem https://t.co/c3CAUUJLSH,presiden pilih prabowo subianto komitmen lanjut program program strategis canang joko widodo ibukotanegaranusantara ikn iknnusantara indonesiaemas2045 smartcity kotamodern indonesiamaju smartdefensesystem
Presiden Terpilih Prabowo Subianto berkomitmen untuk melanjutkan program-program strategis yang telah dicanangkan oleh Joko Widodo termasuk hilirisasi #IbuKotaNegaraNusantara #IKN #IKNNusantara #IndonesiaEmas2045 #SmartCity #KotaModern #IndonesiaMaju #SmartDefenseSystem https://t.co/6wSCEvLLWT,presiden pilih prabowo subianto komitmen lanjut program program strategis canang joko widodo hilir ibukotanegaranusantara ikn iknnusantara indonesiaemas2045 smartcity kotamodern indonesiamaju smartdefensesystem
Presiden Terpilih Prabowo Subianto berkomitmen untuk melanjutkan program-program strategis yang telah dicanangkan oleh Joko Widodo termasuk hilirisasi industri dan pembangunan Ibu Kota Negara (IKN). #IbuKotaNegaraNusantara #IKN #IKNNusantara #IndonesiaEmas2045 #SmartCity https://t.co/igNxtCm5VZ,presiden pilih prabowo subianto komitmen lanjut program program strategis canang joko widodo hilir industri bangun kota negara ikn ibukotanegaranusantara ikn iknnusantara indonesiaemas2045 smartcity
Kaum bembenci makin kejang kejang nih kalau tau presiden @jokowi Kenalkan pak @prabowo ke Paus Fransiskus. https://t.co/hw7AcrYK9R,kaum bembenci kejang kejang nih tau presiden kenal paus fransiskus
Pujian datang dari pemimpin dunia kepada presiden terpilih @prabowo #JudolSesat Aiman Kaesang #TimnasDay #LOEWE Akira Toriyama CPNS Peruri Pope https://t.co/FokKLJ6U2f,puji pimpin dunia presiden pilih judolsesat aiman kaesang timnasday loewe akira toriyama cpns uri pope
Presiden Terpilih Prabowo Subianto berkomitmen untuk melanjutkan program strategis Presiden Joko Widodo termasuk hilirisasi industri dan pembangunan Ibu Kota Negara (IKN). #IbuKotaNegaraNusantara #IKN #IKNNusantara #IndonesiaEmas2045 #SmartCity #KotaModern #IndonesiaMaju https://t.co/u26qx04quY,presiden pilih prabowo subianto komitmen lanjut program strategis presiden joko widodo hilir industri bangun kota negara ikn ibukotanegaranusantara ikn iknnusantara indonesiaemas2045 smartcity kotamodern indonesiamaju
Bertemu di Istana Negara Paus Fransiskus Apresiasi Presiden Jokowi yang Mengenalkan Prabowo sebagai Presiden Terpilih https://t.co/Nk9OKILJrU,temu istana negara paus fransiskus apresiasi presiden jokowi kenal prabowo presiden pilih
Presiden terpilih Prabowo Subianto makin harum di kancah dunia. Meskipun belum dilantik sebagai Presiden ke-8 RI @prabowo sudah banyak mendapat pujian dari pemimpin dunia. https://t.co/O8QQAlYxLE,presiden pilih prabowo subianto harum kancah dunia lantik presiden 8 ri puji pimpin dunia
ini kalau ada orang timeskip sekitar 10 tahunan palanya pusing kali ya liat timeline rocky gerung banyak yang dukung gibran kaesang dibenci anies baswedan direbutin jadi gubernur udah gitu prabowo jadi presiden.,orang timeskip 10 tahun pala pusing kali ya liat timeline rocky gerung dukung gibran kaesang benci anies baswedan direbutin gubernur udah gitu prabowo presiden
beda level berpikir... Aiman hny naikan rating acaranya sj (narasum yg diundang tdk seimbang dgn RG) shg ada pembelajaran bagi publik. RG adlh aset yg diperlukan utk menjaga marwah demokrasi oleh krn itu para mantan presiden dan Prabowo mau berteman dgn RG. salam akal sehat!,beda level pikir aiman hny naik rating acara sj narasum yg undang tdk imbang dgn rg shg ajar publik rg adlh aset yg utk jaga marwah demokrasi krn mantan presiden prabowo teman dgn rg salam akal sehat
Ini Refli Harun? Bicara kekaguman dan harapan pd Presiden terpilih @prabowo bukan tentang sosok yg didukungnya di pilpres lalu Terus terang saya paling senang mendengar pidato Prabowo dibanding pejabat2 lain. Semoga dia bisa mewujudkan bumi air dan SDA dikuasai negara dan https://t.co/TQ0LnwG0zQ,refli harun bicara kagum harap pd presiden pilih sosok yg dukung pilpres terang senang dengar pidato prabowo banding pejabat2 moga wujud bumi air sda asai negara
Presiden dan Wakil Presiden terpilih Prabowo-Gibran menargetkan investasi masuk Indonesia sebesar Rp11 8 triliun dalam periode 2025-2029 dengan fokus pada sektor hijau infrastruktur dan energi berkelanjutan. #PerekonomianMaju #PrabowoGibran #Investasi #PertumbuhanEkonomi https://t.co/K55FBuZkq3,presiden wakil presiden pilih prabowo gibran target investasi masuk indonesia rp11 8 triliun periode 2025 2029 fokus sektor hijau infrastruktur energi lanjut perekonomianmaju prabowogibran investasi pertumbuhanekonomi
Tak peduli siapapun pilihanmu saat Pilpres yg pasti kita punya musuh besar bersama KORUPSI Presiden terpilih @prabowo bersiap PERANGI KORUPSI MATILAH kau koruptor sembunyi di lubang semut pun pasti tertangkap KEREN kali kalo punya Pasukan Khusus Pengejar Koruptor 🇮🇩 https://t.co/7UPxPEkfd7,peduli pilih pilpres yg musuh korupsi presiden pilih rang korupsi mati kau koruptor sembunyi lubang semut tangkap keren kali kalo pasu khusus kejar koruptor
Saat akan memulai pidatonya di Istana Negara pada Rabu (4/9/2024) Paus Fransiskus menyapa presiden terpilih Prabowo Subianto. Ia menyampaikan salam hangatnya pada Prabowo. . Selain itu Paus berharap Prabowo dapat mengemban tugasnya dengan baik setelah menggantikan Presiden https://t.co/DHVA3ehtxl,pidato istana negara rabu 4 9 2024 paus fransiskus sapa presiden pilih prabowo subianto salam hangat prabowo paus harap prabowo emban tugas ganti presiden
Hari ini Paus Fransiskus berkunjung ke Istana Kepresidenan pada Rabu (4/9/2024). Ia disambut oleh Presiden Jokowi Presiden Terpilih Prabowo Subianto dan puluhan anak-anak yang menggunakan busana adat. Seperti apa kunjungan Paus ke Istana Kepresidenan? Tonton videonya sampai https://t.co/Lj8TTGDnQX,paus fransiskus kunjung istana presiden rabu 4 9 2024 sambut presiden jokowi presiden pilih prabowo subianto puluh anak anak busana adat kunjung paus istana presiden tonton video
Presiden Terpilih Prabowo Subianto berkomitmen untuk melanjutkan program-program strategis yang telah dicanangkan oleh Joko Widodo termasuk hilirisasi industri dan pembangunan Ibu Kota Negara (IKN). #IKNNusantara #IndonesiaEmas2045 #SmartCity #KotaModern #IndonesiaMaju https://t.co/61A9wHkD1L,presiden pilih prabowo subianto komitmen lanjut program program strategis canang joko widodo hilir industri bangun kota negara ikn iknnusantara indonesiaemas2045 smartcity kotamodern indonesiamaju
Presiden Prabowo komitmen lanjut pembangunan IKN! Pembangunan yang berkelanjutan bikin negara makin maju! #IbuKotaNegaraNusantara #IKN #IKNNusantara #IndonesiaEmas2045 #SmartCity #KotaModern #IndonesiaMaju #SmartDefenseSystem https://t.co/imySuu0hkR,presiden prabowo komitmen bangun ikn bangun lanjut bikin negara maju ibukotanegaranusantara ikn iknnusantara indonesiaemas2045 smartcity kotamodern indonesiamaju smartdefensesystem
Jakarta https://t.co/aBMaNi0Rkd - Menteri Pertahanan RI (Menhan RI) Prabowo Subianto mendampingi Presiden Joko Widodo dalam kunjungan Pemimpin Tertinggi ... https://t.co/9VjSnht0St,jakarta menteri tahan ri menhan ri prabowo subianto damping presiden joko widodo kunjung pimpin tinggi
Prabowo aja bilang kalo puan maunya jadi wakil presiden .. walaupun itu berkelakar tetap aja emang gitu karepnya ,prabowo aja bilang kalo puan mau wakil presiden kelakar aja emang gitu karepnya
Presiden Terpilih Prabowo Subianto berkomitmen untuk melanjutkan program-program strategis yang telah dicanangkan oleh Joko Widodo termasuk hilirisasi industri dan pembangunan IKN #IbuKotaNegaraNusantara #IKN #IKNNusantara #IndonesiaEmas2045 #SmartCity #KotaModern #IndonesiaMaju https://t.co/VA2Jx4qevi,presiden pilih prabowo subianto komitmen lanjut program program strategis canang joko widodo hilir industri bangun ikn ibukotanegaranusantara ikn iknnusantara indonesiaemas2045 smartcity kotamodern indonesiamaju
Paus Fransiskus bertemu Presiden terpilih Prabowo Subianto beri pesan toleransi dan kerukunan antar bangsa - Indonesia Insider https://t.co/bL08AFYgwV,paus fransiskus temu presiden pilih prabowo subianto pesan toleransi rukun bangsa indonesia insider
Presiden Terpilih Prabowo Subianto berkomitmen untuk melanjutkan program-program strategis yang telah dicanangkan oleh Joko Widodo termasuk hilirisasi industri dan pembangunan IKN. #IbuKotaNegaraNusantara #IKNNusantara #IndonesiaEmas2045 #SmartCity #SmartDefenseSystem https://t.co/WOb21ghgz4,presiden pilih prabowo subianto komitmen lanjut program program strategis canang joko widodo hilir industri bangun ikn ibukotanegaranusantara iknnusantara indonesiaemas2045 smartcity smartdefensesystem
Presiden Terpilih Prabowo Subianto berkomitmen untuk melanjutkan program-program strategis yang telah dicanangkan oleh Joko Widodo termasuk hilirisasi industri dan pembangunan Ibu Kota Negara (IKN). #IbuKotaNegaraNusantara #IKN #IKNNusantara #IndonesiaEmas2045 #SmartCity https://t.co/KMxscWIpl0,presiden pilih prabowo subianto komitmen lanjut program program strategis canang joko widodo hilir industri bangun kota negara ikn ibukotanegaranusantara ikn iknnusantara indonesiaemas2045 smartcity
Jokowi Perkenalkan Prabowo ke Paus Fransiskus Sebagai Presiden Terpilih RI https://t.co/sl7m08cxvk,jokowi kenal prabowo paus fransiskus presiden pilih ri
Presiden Terpilih Prabowo Subianto berkomitmen untuk melanjutkan program-program strategis yang telah dicanangkan oleh Joko Widodo #IbuKotaNegaraNusantara #IKN #IKNNusantara #IndonesiaEmas2045 #SmartCity #KotaModern #IndonesiaMaju #SmartDefenseSystem https://t.co/DgKQ4L4b0Q,presiden pilih prabowo subianto komitmen lanjut program program strategis canang joko widodo ibukotanegaranusantara ikn iknnusantara indonesiaemas2045 smartcity kotamodern indonesiamaju smartdefensesystem
Anggaran untuk IKN tahun depan dari presiden Prabowo Subianto hanya 0.36% atau 'cuma' 141 milyar lebih dikit. Akan mangkrak kah IKN? Mungkin tidak tapi mungkin baru selesai setelah 30 tahun atau lebih kecuali ada investor. https://t.co/wHufAFGA7p,anggar ikn presiden prabowo subianto 0 36 141 milyar dikit mangkrak kah ikn selesai 30 kecuali investor
dear presiden terbaru pa prabowo. bnyk anak kecil kelakuan setan kaya gini. semoga hukum buat anak setan kaya gini lebih ketat lagi. kalo emg ngga bisa dihukum karna minor tunggu dia 17 tahun lanjut proses hukumnya. @prabowo,dear presiden baru pa prabowo bnyk anak laku setan kaya gin moga hukum anak setan kaya gin ketat kalo emg ngga hukum karna minor tunggu 17 proses hukum
Presiden Terpilih Prabowo Subianto berkomitmen untuk melanjutkan program-program strategis yang telah dicanangkan oleh Joko Widodo termasuk hilirisasi industri dan pembangunan Ibu Kota Negara (IKN). #IbuKotaNegaraNusantara #IKN #IKNNusantara #IndonesiaEmas2045 #SmartCity https://t.co/aeBtjhaGLu,presiden pilih prabowo subianto komitmen lanjut program program strategis canang joko widodo hilir industri bangun kota negara ikn ibukotanegaranusantara ikn iknnusantara indonesiaemas2045 smartcity
Silfester Matutina SH alumni Universitas Wiraswasta Indonesia ? - Dia adalah waketum TKN Prabowo-Gibran - Ternyata Silfester debat dg Adian Napitupulu maupun debat RG argumen Silfester selalu sama yaitu Sebutkan UU mana yg dilanggar Presiden Jokowi. - Coba simak https://t.co/dTtiLcCKh9,silfester matutina sh alumni universitas wiraswasta indonesia waketum tkn prabowo gibran silfester debat dg adi napitupulu debat rg argumen silfester sebut uu yg langgar presiden jokowi coba simak
Gue kok malu &amp; lucu lihanya...presiden terpilih Pak Prabowo belum dilantik partainya aja belum dibentuk tp anak2 Abah udah teriak2 Anies presiden 2029 https://t.co/gZPFSqo5V2,gue malu amp lucu lihanya presiden pilih prabowo lantik partai aja bentuk tp anak2 abah udah teriak2 anies presiden 2029
Bisa memaafkan tapi mungkin tidak bisa melupakan. Di momen sedih ini banyak di antara kami yg berjanji pada diri sendiri untuk mengawal terus Pak Prabowo sampai menang bahkan sampai selesai tugas nya menjadi Presiden Republik Indonesia. https://t.co/u5JkGiHKJP,maaf lupa momen sedih yg janji awal prabowo menang selesai tugas nya presiden republik indonesia
Momen‼️ Bersejarah september 2024... Presiden Jokowi-Presiden terpilih Prabowo bersama Paus Fransiskus. https://t.co/sENvopwFf0,momen sejarah september 2024 presiden jokowi presiden pilih prabowo paus fransiskus
Presiden terpilih Prabowo Subianto menjadi menteri pertama yang menyalami Paus Fransiskus. Pemimpin Vatikan itu berada di Istana Negara untuk bertemu Presiden Jokowi. KitaJUNJUNG TinggiTOLERANSI JagaKEBERAGAMAN JagaKEUTUHAN https://t.co/bauNHUN1wp,presiden pilih prabowo subianto menteri salam paus fransiskus pimpin vatikan istana negara temu presiden jokowi kitajunjung tinggitoleransi jagakeberagaman jagakeutuhan
Prabowo Presiden Terpilih bersalaman dengan Paus Fransiskus 🇮🇩 #projo #jokowi #IndonesiaEmas JagaKEBERAGAMAN JagaKEUTUHAN https://t.co/rEkUqycp4U,prabowo presiden pilih salam paus fransiskus projo jokowi indonesiaemas jagakeberagaman jagakeutuhan
Paus Fransiskus Ucapkan Salam Hangat untuk Presiden Terpilih Prabowo https://t.co/JwEX1E7Gwa.,paus fransiskus ucap salam hangat presiden pilih prabowo
Keberlanjutan Perekonomian pada masa Pemerintahan Jokowi akan dilanjutkan Oleh Presiden Terpilih Prabowo Subianto #IbuKotaNegaraNusantara #IKN #IKNNusantara #IndonesiaEmas2045 #SmartCity #KotaModern #IndonesiaMaju #SmartDefenseSystem https://t.co/kMhk8PPDeM,lanjut ekonomi perintah jokowi lanjut presiden pilih prabowo subianto ibukotanegaranusantara ikn iknnusantara indonesiaemas2045 smartcity kotamodern indonesiamaju smartdefensesystem
Saya berkesempatan mendampingi Bapak Presiden RI melaksanakan pertemuan dengan Pemimpin Gereja Katolik Dunia sekaligus Kepala Negara Vatikan Paus Fransiskus di Istana Negara Jakarta. Kunjungan Apostolik Paus Fransiskus ke Indonesia mengawali rangkaian perjalanan ke 4 Negara https://t.co/4Y1m5cqoon,sempat damping presiden ri laksana temu pimpin gereja katolik dunia kepala negara vatikan paus fransiskus istana negara jakarta kunjung apostolik paus fransiskus indonesia awal rangkai jalan 4 negara
Presiden terpilih Prabowo Subianto berencana membangun empat SMA unggulan di IKN Kaesang Innalillahi Aiman Pisang Paus Pope Francis CPNS Peruri Jatinangor Rocky アリーナ全滅 #giants #sbhawks #seibulions #lovefighters #chibalotte https://t.co/9fl99ZwOuE,presiden pilih prabowo subianto rencana bangun sma unggul ikn kaesang innalillahi aiman pisang paus pope francis cpns uri jatinangor rocky  giants sbhawks seibulions lovefighters chibalotte
Momen Spesial Jokowi Kenalkan Presiden Terpilih Prabowo ke Paus Fransiskus di Istana https://t.co/taAIpkWgun,momen spesial jokowi kenal presiden pilih prabowo paus fransiskus istana
Saat menerima kunjungan Paus Fransiskus di Istana Presiden Joko Widodo mengenalkan presiden terpilih Prabowo Subianto dan juga para menteri dari Kabinet Indonesia Maju. #pausfransiskus #kunjunganpausfransiskus #jokowidodo #prabowosubianto https://t.co/FekNVpeQkp,terima kunjung paus fransiskus istana presiden joko widodo kenal presiden pilih prabowo subianto menteri kabinet indonesia maju pausfransiskus kunjunganpausfransiskus jokowidodo prabowosubianto
Presiden terpilih Prabowo dan Perdana Menteri Timor Leste Xanana Gusmao ketika muda berhadapan di medan perang. Bukan sebagai komandan di ruangan ber-AC tapi bertempur di lapangan membawa senapan saling bunuh. Mereka kini berdamai tidak bisakah Timur Tengah belajar dari mereka? https://t.co/NRaGWEbXgv,presiden pilih prabowo perdana menteri timor leste xanana gusmao muda hadap medan perang komandan ruang ber ac tempur lapang bawa senapan bunuh damai timur ajar
Presiden terpilih Prabowo Subianto makin harum di kancah dunia. Meskipun belum dilantik sebagai Presiden ke-8 RI Prabowo sudah banyak mendapat pujian dari pemimpin dunia. #𝐉𝐮𝐝𝐨𝐥𝐉𝐚𝐡𝐚𝐭 Lapor Pak Nanas Aiman Bocil Garut Pisang https://t.co/3LwSJ1psjN https://t.co/i1ngW0goPl,presiden pilih prabowo subianto harum kancah dunia lantik presiden 8 ri prabowo puji pimpin dunia  lapor nanas aiman bocil garut pisang
